Country_Region,Last_Update,Confirmed,Deaths,Recovered,Active,Delta_Confirmed,Delta_Recovered,Incident_Rate,People_Tested,People_Hospitalized,Province_State,FIPS,UID,iso3,Report_Date_String,Delta_Deaths,Doses_Admin,Delta_Doses_Admin
Afghanistan,10/18/22,201503,7812,,,227,,517.625449283852,,,,,4,AFG,2022/10/18,1,0,
Afghanistan,10/18/22,201503,7812,,,227,,517.625449283852,,,,,4,AFG,2022/10/18,1,11951964,11951964
Afghanistan,10/19/22,201557,7812,,,54,,517.7641657012817,,,,,4,AFG,2022/10/19,0,0,
Afghanistan,10/19/22,201557,7812,,,54,,517.7641657012817,,,,,4,AFG,2022/10/19,0,11951964,11951964
Afghanistan,10/20/22,201750,7814,,,193,,518.2599484524656,,,,,4,AFG,2022/10/20,2,0,
Afghanistan,10/20/22,201750,7814,,,193,,518.2599484524656,,,,,4,AFG,2022/10/20,2,11977773,11977773
Afghanistan,10/21/22,201949,7818,,,199,,518.7711441389192,,,,,4,AFG,2022/10/21,4,0,
Afghanistan,10/21/22,201949,7818,,,199,,518.7711441389192,,,,,4,AFG,2022/10/21,4,11977773,11977773
Afghanistan,10/22/22,202026,7818,,,77,,518.9689434748838,,,,,4,AFG,2022/10/22,0,0,
Afghanistan,10/22/22,202026,7818,,,77,,518.9689434748838,,,,,4,AFG,2022/10/22,0,11977773,11977773
Afghanistan,10/23/22,202108,7818,,,82,,519.1795869235732,,,,,4,AFG,2022/10/23,0,0,
Afghanistan,10/23/22,202108,7818,,,82,,519.1795869235732,,,,,4,AFG,2022/10/23,0,11977773,11977773
Afghanistan,10/24/22,202199,7818,,,91,,519.4133497751676,,,,,4,AFG,2022/10/24,0,0,
Afghanistan,10/24/22,202199,7818,,,91,,519.4133497751676,,,,,4,AFG,2022/10/24,0,11977773,11977773
Afghanistan,10/25/22,202347,7820,,,148,,519.7935355118267,,,,,4,AFG,2022/10/25,2,0,
Afghanistan,10/25/22,202347,7820,,,148,,519.7935355118267,,,,,4,AFG,2022/10/25,2,11977773,11977773
Afghanistan,10/26/22,202509,7820,,,162,,520.2096847641157,,,,,4,AFG,2022/10/26,0,0,
Afghanistan,10/26/22,202509,7820,,,162,,520.2096847641157,,,,,4,AFG,2022/10/26,0,12055358,12055358
Afghanistan,10/27/22,202608,7820,,,99,,520.4639981960701,,,,,4,AFG,2022/10/27,0,0,
Afghanistan,10/27/22,202608,7820,,,99,,520.4639981960701,,,,,4,AFG,2022/10/27,0,12055358,12055358
Afghanistan,10/28/22,202756,7820,,,148,,520.8441839327292,,,,,4,AFG,2022/10/28,0,0,
Afghanistan,10/28/22,202756,7820,,,148,,520.8441839327292,,,,,4,AFG,2022/10/28,0,12055358,12055358
Afghanistan,10/29/22,202834,7821,,,78,,521.0445520912386,,,,,4,AFG,2022/10/29,1,0,
Afghanistan,10/29/22,202834,7821,,,78,,521.0445520912386,,,,,4,AFG,2022/10/29,1,12055358,12055358
Afghanistan,10/30/22,202966,7821,,,132,,521.3836366671778,,,,,4,AFG,2022/10/30,0,0,
Afghanistan,10/30/22,202966,7821,,,132,,521.3836366671778,,,,,4,AFG,2022/10/30,0,12055358,12055358
Afghanistan,10/31/22,203063,7822,,,97,,521.6328124540422,,,,,4,AFG,2022/10/31,1,0,
Afghanistan,10/31/22,203063,7822,,,97,,521.6328124540422,,,,,4,AFG,2022/10/31,1,12055358,12055358
Afghanistan,11/1/22,203167,7823,,,104,,521.8999699987215,,,,,4,AFG,2022/11/01,1,0,
Afghanistan,11/1/22,203167,7823,,,104,,521.8999699987215,,,,,4,AFG,2022/11/01,1,12055358,12055358
Afghanistan,11/2/22,203265,7823,,,98,,522.1517146081309,,,,,4,AFG,2022/11/02,0,0,
Afghanistan,11/2/22,203265,7823,,,98,,522.1517146081309,,,,,4,AFG,2022/11/02,0,12103780,12103780
Afghanistan,11/3/22,203395,7825,,,130,,522.48566153898,,,,,4,AFG,2022/11/03,2,0,
Afghanistan,11/3/22,203395,7825,,,130,,522.48566153898,,,,,4,AFG,2022/11/03,2,12140367,12140367
Afghanistan,11/4/22,203497,7825,,,102,,522.7476814385694,,,,,4,AFG,2022/11/04,0,0,
Afghanistan,11/4/22,203497,7825,,,102,,522.7476814385694,,,,,4,AFG,2022/11/04,0,12140367,12140367
Afghanistan,11/5/22,203574,7826,,,77,,522.945480774534,,,,,4,AFG,2022/11/05,1,0,
Afghanistan,11/5/22,203574,7826,,,77,,522.945480774534,,,,,4,AFG,2022/11/05,1,12140367,12140367
Afghanistan,11/6/22,203681,7826,,,107,,523.2203447868483,,,,,4,AFG,2022/11/06,0,0,
Afghanistan,11/6/22,203681,7826,,,107,,523.2203447868483,,,,,4,AFG,2022/11/06,0,12140367,12140367
Afghanistan,11/7/22,203829,7828,,,148,,523.6005305235072,,,,,4,AFG,2022/11/07,2,0,
Afghanistan,11/7/22,203829,7828,,,148,,523.6005305235072,,,,,4,AFG,2022/11/07,2,12140367,12140367
Afghanistan,11/8/22,203942,7829,,,113,,523.8908074710915,,,,,4,AFG,2022/11/08,1,0,
Afghanistan,11/8/22,203942,7829,,,113,,523.8908074710915,,,,,4,AFG,2022/11/08,1,12140367,12140367
Afghanistan,11/9/22,204094,7829,,,152,,524.2812684979306,,,,,4,AFG,2022/11/09,0,0,
Afghanistan,11/9/22,204094,7829,,,152,,524.2812684979306,,,,,4,AFG,2022/11/09,0,12140367,12140367
Afghanistan,11/10/22,204287,7829,,,193,,524.7770512491144,,,,,4,AFG,2022/11/10,0,,
Afghanistan,11/11/22,204392,7829,,,105,,525.0467776163387,,,,,4,AFG,2022/11/11,0,,
Afghanistan,11/12/22,204417,7829,,,25,,525.1109981799635,,,,,4,AFG,2022/11/12,0,,
Afghanistan,11/13/22,204510,7829,,,93,,525.349898676648,,,,,4,AFG,2022/11/13,0,,
Afghanistan,11/14/22,204610,7829,,,100,,525.6067809311473,,,,,4,AFG,2022/11/14,0,,
Albania,10/18/22,332673,3592,,,28,,11559.976370838835,,,,,8,ALB,2022/10/18,0,0,
Albania,10/18/22,332673,3592,,,28,,11559.976370838835,,,,,8,ALB,2022/10/18,0,2978248,2978248
Albania,10/19/22,332701,3592,,,28,,11560.949336298561,,,,,8,ALB,2022/10/19,0,0,
Albania,10/19/22,332701,3592,,,28,,11560.949336298561,,,,,8,ALB,2022/10/19,0,2978248,2978248
Albania,10/20/22,332719,3592,,,18,,11561.5748140941,,,,,8,ALB,2022/10/20,0,0,
Albania,10/20/22,332719,3592,,,18,,11561.5748140941,,,,,8,ALB,2022/10/20,0,2991576,2991576
Albania,10/21/22,332739,3592,,,20,,11562.269789422475,,,,,8,ALB,2022/10/21,0,0,
Albania,10/21/22,332739,3592,,,20,,11562.269789422475,,,,,8,ALB,2022/10/21,0,2991576,2991576
Albania,10/22/22,332754,3592,,,15,,11562.791020918758,,,,,8,ALB,2022/10/22,0,0,
Albania,10/22/22,332754,3592,,,15,,11562.791020918758,,,,,8,ALB,2022/10/22,0,2991576,2991576
Albania,10/23/22,332772,3592,,,18,,11563.416498714296,,,,,8,ALB,2022/10/23,0,0,
Albania,10/23/22,332772,3592,,,18,,11563.416498714296,,,,,8,ALB,2022/10/23,0,2991576,2991576
Albania,10/24/22,332776,3592,,,4,,11563.555493779972,,,,,8,ALB,2022/10/24,0,0,
Albania,10/24/22,332776,3592,,,4,,11563.555493779972,,,,,8,ALB,2022/10/24,0,2991576,2991576
Albania,10/25/22,332816,3592,,,40,,11564.945444436722,,,,,8,ALB,2022/10/25,0,0,
Albania,10/25/22,332816,3592,,,40,,11564.945444436722,,,,,8,ALB,2022/10/25,0,2991576,2991576
Albania,10/26/22,332847,3593,,,31,,11566.022656195704,,,,,8,ALB,2022/10/26,1,0,
Albania,10/26/22,332847,3593,,,31,,11566.022656195704,,,,,8,ALB,2022/10/26,1,2991576,2991576
Albania,10/27/22,332889,3593,,,42,,11567.482104385293,,,,,8,ALB,2022/10/27,0,0,
Albania,10/27/22,332889,3593,,,42,,11567.482104385293,,,,,8,ALB,2022/10/27,0,2991576,2991576
Albania,10/28/22,332911,3593,,,22,,11568.246577246508,,,,,8,ALB,2022/10/28,0,0,
Albania,10/28/22,332911,3593,,,22,,11568.246577246508,,,,,8,ALB,2022/10/28,0,2991576,2991576
Albania,10/29/22,332949,3593,,,38,,11569.567030370421,,,,,8,ALB,2022/10/29,0,0,
Albania,10/29/22,332949,3593,,,38,,11569.567030370421,,,,,8,ALB,2022/10/29,0,2991576,2991576
Albania,10/30/22,332966,3593,,,17,,11570.15775939954,,,,,8,ALB,2022/10/30,0,0,
Albania,10/30/22,332966,3593,,,17,,11570.15775939954,,,,,8,ALB,2022/10/30,0,2991576,2991576
Albania,11/1/22,332969,3593,,,3,,11570.262005698798,,,,,8,ALB,2022/11/01,0,0,
Albania,11/1/22,332969,3593,,,3,,11570.262005698798,,,,,8,ALB,2022/11/01,0,2991576,2991576
Albania,11/2/22,332996,3593,,,27,,11571.200222392104,,,,,8,ALB,2022/11/02,0,0,
Albania,11/2/22,332996,3593,,,27,,11571.200222392104,,,,,8,ALB,2022/11/02,0,2991576,2991576
Albania,11/4/22,333027,3593,,,31,,11572.277434151089,,,,,8,ALB,2022/11/04,0,0,
Albania,11/4/22,333027,3593,,,31,,11572.277434151089,,,,,8,ALB,2022/11/04,0,2991576,2991576
Albania,11/5/22,333046,3593,,,19,,11572.937660713045,,,,,8,ALB,2022/11/05,0,0,
Albania,11/5/22,333046,3593,,,19,,11572.937660713045,,,,,8,ALB,2022/11/05,0,2991576,2991576
Albania,11/6/22,333055,3593,,,9,,11573.250399610813,,,,,8,ALB,2022/11/06,0,0,
Albania,11/6/22,333055,3593,,,9,,11573.250399610813,,,,,8,ALB,2022/11/06,0,2991576,2991576
Albania,11/7/22,333058,3593,,,3,,11573.35464591007,,,,,8,ALB,2022/11/07,0,0,
Albania,11/7/22,333058,3593,,,3,,11573.35464591007,,,,,8,ALB,2022/11/07,0,2991576,2991576
Albania,11/8/22,333071,3593,,,13,,11573.806379873515,,,,,8,ALB,2022/11/08,0,0,
Albania,11/8/22,333071,3593,,,13,,11573.806379873515,,,,,8,ALB,2022/11/08,0,2991576,2991576
Albania,11/9/22,333088,3593,,,17,,11574.397108902634,,,,,8,ALB,2022/11/09,0,0,
Albania,11/9/22,333088,3593,,,17,,11574.397108902634,,,,,8,ALB,2022/11/09,0,2991576,2991576
Albania,11/10/22,333103,3593,,,15,,11574.918340398915,,,,,8,ALB,2022/11/10,0,,
Albania,11/11/22,333125,3593,,,22,,11575.68281326013,,,,,8,ALB,2022/11/11,0,,
Albania,11/12/22,333138,3593,,,13,,11576.134547223573,,,,,8,ALB,2022/11/12,0,,
Albania,11/13/22,333156,3593,,,18,,11576.760025019112,,,,,8,ALB,2022/11/13,0,,
Albania,11/14/22,333161,3594,,,5,,11576.933768851206,,,,,8,ALB,2022/11/14,1,,
Algeria,10/18/22,270766,6881,,,9,,617.4676392531873,,,,,12,DZA,2022/10/18,0,0,
Algeria,10/18/22,270766,6881,,,9,,617.4676392531873,,,,,12,DZA,2022/10/18,0,15267442,15267442
Algeria,10/19/22,270768,6881,,,2,,617.4722001481242,,,,,12,DZA,2022/10/19,0,0,
Algeria,10/19/22,270768,6881,,,2,,617.4722001481242,,,,,12,DZA,2022/10/19,0,15267442,15267442
Algeria,10/20/22,270769,6881,,,1,,617.4744805955927,,,,,12,DZA,2022/10/20,0,0,
Algeria,10/20/22,270769,6881,,,1,,617.4744805955927,,,,,12,DZA,2022/10/20,0,15267442,15267442
Algeria,10/21/22,270771,6881,,,2,,617.4790414905297,,,,,12,DZA,2022/10/21,0,0,
Algeria,10/21/22,270771,6881,,,2,,617.4790414905297,,,,,12,DZA,2022/10/21,0,15267442,15267442
Algeria,10/23/22,270783,6881,,,12,,617.5064068601515,,,,,12,DZA,2022/10/23,0,0,
Algeria,10/23/22,270783,6881,,,12,,617.5064068601515,,,,,12,DZA,2022/10/23,0,15267442,15267442
Algeria,10/24/22,270788,6881,,,5,,617.517809097494,,,,,12,DZA,2022/10/24,0,0,
Algeria,10/24/22,270788,6881,,,5,,617.517809097494,,,,,12,DZA,2022/10/24,0,15267442,15267442
Algeria,10/25/22,270800,6881,,,12,,617.5451744671159,,,,,12,DZA,2022/10/25,0,0,
Algeria,10/25/22,270800,6881,,,12,,617.5451744671159,,,,,12,DZA,2022/10/25,0,15267442,15267442
Algeria,10/26/22,270810,6881,,,10,,617.5679789418008,,,,,12,DZA,2022/10/26,0,0,
Algeria,10/26/22,270810,6881,,,10,,617.5679789418008,,,,,12,DZA,2022/10/26,0,15267442,15267442
Algeria,10/27/22,270817,6881,,,7,,617.5839420740803,,,,,12,DZA,2022/10/27,0,0,
Algeria,10/27/22,270817,6881,,,7,,617.5839420740803,,,,,12,DZA,2022/10/27,0,15267442,15267442
Algeria,10/28/22,270826,6881,,,9,,617.6044661012966,,,,,12,DZA,2022/10/28,0,0,
Algeria,10/28/22,270826,6881,,,9,,617.6044661012966,,,,,12,DZA,2022/10/28,0,15267442,15267442
Algeria,10/29/22,270829,6881,,,3,,617.6113074437021,,,,,12,DZA,2022/10/29,0,0,
Algeria,10/29/22,270829,6881,,,3,,617.6113074437021,,,,,12,DZA,2022/10/29,0,15267442,15267442
Algeria,10/30/22,270836,6881,,,7,,617.6272705759815,,,,,12,DZA,2022/10/30,0,0,
Algeria,10/30/22,270836,6881,,,7,,617.6272705759815,,,,,12,DZA,2022/10/30,0,15267442,15267442
Algeria,10/31/22,270838,6881,,,2,,617.6318314709185,,,,,12,DZA,2022/10/31,0,0,
Algeria,10/31/22,270838,6881,,,2,,617.6318314709185,,,,,12,DZA,2022/10/31,0,15267442,15267442
Algeria,11/1/22,270839,6881,,,1,,617.634111918387,,,,,12,DZA,2022/11/01,0,0,
Algeria,11/1/22,270839,6881,,,1,,617.634111918387,,,,,12,DZA,2022/11/01,0,15267442,15267442
Algeria,11/2/22,270840,6881,,,1,,617.6363923658555,,,,,12,DZA,2022/11/02,0,0,
Algeria,11/2/22,270840,6881,,,1,,617.6363923658555,,,,,12,DZA,2022/11/02,0,15267442,15267442
Algeria,11/3/22,270847,6881,,,7,,617.6523554981349,,,,,12,DZA,2022/11/03,0,0,
Algeria,11/3/22,270847,6881,,,7,,617.6523554981349,,,,,12,DZA,2022/11/03,0,15267442,15267442
Algeria,11/4/22,270856,6881,,,9,,617.6728795253513,,,,,12,DZA,2022/11/04,0,0,
Algeria,11/4/22,270856,6881,,,9,,617.6728795253513,,,,,12,DZA,2022/11/04,0,15267442,15267442
Algeria,11/5/22,270862,6881,,,6,,617.6865622101623,,,,,12,DZA,2022/11/05,0,0,
Algeria,11/5/22,270862,6881,,,6,,617.6865622101623,,,,,12,DZA,2022/11/05,0,15267442,15267442
Algeria,11/6/22,270873,6881,,,11,,617.7116471323156,,,,,12,DZA,2022/11/06,0,0,
Algeria,11/6/22,270873,6881,,,11,,617.7116471323156,,,,,12,DZA,2022/11/06,0,15267442,15267442
Algeria,11/7/22,270881,6881,,,8,,617.7298907120636,,,,,12,DZA,2022/11/07,0,0,
Algeria,11/7/22,270881,6881,,,8,,617.7298907120636,,,,,12,DZA,2022/11/07,0,15267442,15267442
Algeria,11/8/22,270891,6881,,,10,,617.7526951867485,,,,,12,DZA,2022/11/08,0,0,
Algeria,11/8/22,270891,6881,,,10,,617.7526951867485,,,,,12,DZA,2022/11/08,0,15267442,15267442
Algeria,11/9/22,270906,6881,,,15,,617.7869018987758,,,,,12,DZA,2022/11/09,0,0,
Algeria,11/9/22,270906,6881,,,15,,617.7869018987758,,,,,12,DZA,2022/11/09,0,15267442,15267442
Algeria,11/10/22,270917,6881,,,11,,617.8119868209292,,,,,12,DZA,2022/11/10,0,,
Algeria,11/11/22,270924,6881,,,7,,617.8279499532086,,,,,12,DZA,2022/11/11,0,,
Algeria,11/12/22,270929,6881,,,5,,617.839352190551,,,,,12,DZA,2022/11/12,0,,
Algeria,11/13/22,270939,6881,,,10,,617.862156665236,,,,,12,DZA,2022/11/13,0,,
Algeria,11/14/22,270952,6881,,,13,,617.8918024823264,,,,,12,DZA,2022/11/14,0,,
Andorra,10/18/22,46366,155,,,0,,60009.05972950236,,,,,20,AND,2022/10/18,0,0,
Andorra,10/18/22,46366,155,,,0,,60009.05972950236,,,,,20,AND,2022/10/18,0,154216,154216
Andorra,10/19/22,46449,155,,,83,,60116.48223645894,,,,,20,AND,2022/10/19,0,0,
Andorra,10/19/22,46449,155,,,83,,60116.48223645894,,,,,20,AND,2022/10/19,0,154216,154216
Andorra,10/26/22,46535,155,,,86,,60227.78748463082,,,,,20,AND,2022/10/26,0,0,
Andorra,10/26/22,46535,155,,,86,,60227.78748463082,,,,,20,AND,2022/10/26,0,154320,154320
Andorra,11/2/22,46588,155,,,53,,60296.382579434416,,,,,20,AND,2022/11/02,0,0,
Andorra,11/2/22,46588,155,,,53,,60296.382579434416,,,,,20,AND,2022/11/02,0,154320,154320
Andorra,11/9/22,46664,155,,,76,,60394.74535688863,,,,,20,AND,2022/11/09,0,0,
Andorra,11/9/22,46664,155,,,76,,60394.74535688863,,,,,20,AND,2022/11/09,0,154320,154320
Andorra,11/14/22,46664,155,,,0,,60394.74535688863,,,,,20,AND,2022/11/14,0,,
Angola,10/18/22,103131,1917,,,0,,313.78981026990954,,,,,24,AGO,2022/10/18,0,0,
Angola,10/18/22,103131,1917,,,0,,313.78981026990954,,,,,24,AGO,2022/10/18,0,22226535,22226535
Angola,11/14/22,103131,1917,,,0,,313.78981026990954,,,,,24,AGO,2022/11/14,0,,
Antarctica,10/18/22,11,0,,,0,,,,,,,10,ATA,2022/10/18,0,,
Antarctica,11/14/22,11,0,,,0,,,,,,,10,ATA,2022/11/14,0,,
Antigua and Barbuda,10/18/22,9106,146,,,0,,9298.668409443673,,,,,28,ATG,2022/10/18,0,0,
Antigua and Barbuda,10/18/22,9106,146,,,0,,9298.668409443673,,,,,28,ATG,2022/10/18,0,136512,136512
Antigua and Barbuda,11/14/22,9106,146,,,0,,9298.668409443673,,,,,28,ATG,2022/11/14,0,,
Argentina,10/18/22,9715464,129970,,,0,,21496.39777185377,,,,,32,ARG,2022/10/18,0,0,
Argentina,10/18/22,9715464,129970,,,0,,21496.39777185377,,,,,32,ARG,2022/10/18,0,109762463,109762463
Argentina,10/23/22,9717546,129979,,,2082,,21501.00439693735,,,,,32,ARG,2022/10/23,9,0,
Argentina,10/23/22,9717546,129979,,,2082,,21501.00439693735,,,,,32,ARG,2022/10/23,9,109827384,109827384
Argentina,10/30/22,9718875,129991,,,1329,,21503.944937156408,,,,,32,ARG,2022/10/30,12,0,
Argentina,10/30/22,9718875,129991,,,1329,,21503.944937156408,,,,,32,ARG,2022/10/30,12,109897125,109897125
Argentina,11/6/22,9720232,130003,,,1357,,21506.94743006631,,,,,32,ARG,2022/11/06,12,0,
Argentina,11/6/22,9720232,130003,,,1357,,21506.94743006631,,,,,32,ARG,2022/11/06,12,109985773,109985773
Argentina,11/13/22,9721718,130011,,,1486,,21510.23534787332,,,,,32,ARG,2022/11/13,8,,
Argentina,11/14/22,9721718,130011,,,0,,21510.23534787332,,,,,32,ARG,2022/11/14,0,,
Armenia,10/18/22,444869,8706,,,0,,15012.955439901136,,,,,51,ARM,2022/10/18,0,0,
Armenia,10/18/22,444869,8706,,,0,,15012.955439901136,,,,,51,ARM,2022/10/18,0,2150112,2150112
Armenia,10/24/22,445100,8706,,,231,,15020.750976804396,,,,,51,ARM,2022/10/24,0,0,
Armenia,10/24/22,445100,8706,,,231,,15020.750976804396,,,,,51,ARM,2022/10/24,0,2150112,2150112
Armenia,10/31/22,445242,8709,,,142,,15025.543038450558,,,,,51,ARM,2022/10/31,3,0,
Armenia,10/31/22,445242,8709,,,142,,15025.543038450558,,,,,51,ARM,2022/10/31,3,2150112,2150112
Armenia,11/7/22,445397,8709,,,155,,15030.773809965733,,,,,51,ARM,2022/11/07,0,0,
Armenia,11/7/22,445397,8709,,,155,,15030.773809965733,,,,,51,ARM,2022/11/07,0,2150112,2150112
Armenia,11/14/22,445513,8709,,,116,,15034.688451873864,,,,,51,ARM,2022/11/14,0,,
Australia,10/18/22,10312818,15490,,,1206,,40506.4395888404,,,,,36,AUS,2022/10/18,3,0,
Australia,10/18/22,10312818,15490,,,1206,,40506.4395888404,,,,,36,AUS,2022/10/18,3,63461493,63461493
Australia,10/19/22,10313911,15496,,,1093,,40510.73264806734,,,,,36,AUS,2022/10/19,6,0,
Australia,10/19/22,10313911,15496,,,1093,,40510.73264806734,,,,,36,AUS,2022/10/19,6,63461493,63461493
Australia,10/20/22,10341058,15530,,,27147,,40617.35998460312,,,,,36,AUS,2022/10/20,34,0,
Australia,10/20/22,10341058,15530,,,27147,,40617.35998460312,,,,,36,AUS,2022/10/20,34,63461493,63461493
Australia,10/21/22,10341878,15569,,,820,,40620.580760967336,,,,,36,AUS,2022/10/21,39,0,
Australia,10/21/22,10341878,15569,,,820,,40620.580760967336,,,,,36,AUS,2022/10/21,39,63461493,63461493
Australia,10/22/22,10342827,15569,,,949,,40624.3082204425,,,,,36,AUS,2022/10/22,0,0,
Australia,10/22/22,10342827,15569,,,949,,40624.3082204425,,,,,36,AUS,2022/10/22,0,63461493,63461493
Australia,10/23/22,10343747,15569,,,920,,40627.92177441211,,,,,36,AUS,2022/10/23,0,0,
Australia,10/23/22,10343747,15569,,,920,,40627.92177441211,,,,,36,AUS,2022/10/23,0,63461493,63461493
Australia,10/24/22,10345256,15580,,,1509,,40633.84878847747,,,,,36,AUS,2022/10/24,11,0,
Australia,10/24/22,10345256,15580,,,1509,,40633.84878847747,,,,,36,AUS,2022/10/24,11,63461493,63461493
Australia,10/25/22,10346805,15586,,,1549,,40639.932913585,,,,,36,AUS,2022/10/25,6,0,
Australia,10/25/22,10346805,15586,,,1549,,40639.932913585,,,,,36,AUS,2022/10/25,6,63461493,63461493
Australia,10/26/22,10348288,15589,,,1483,,40645.75780547296,,,,,36,AUS,2022/10/26,3,0,
Australia,10/26/22,10348288,15589,,,1483,,40645.75780547296,,,,,36,AUS,2022/10/26,3,63461493,63461493
Australia,10/27/22,10364635,15636,,,16347,,40709.9651606264,,,,,36,AUS,2022/10/27,47,0,
Australia,10/27/22,10364635,15636,,,16347,,40709.9651606264,,,,,36,AUS,2022/10/27,47,63461493,63461493
Australia,10/28/22,10375475,15660,,,10840,,40752.5422530509,,,,,36,AUS,2022/10/28,24,0,
Australia,10/28/22,10375475,15660,,,10840,,40752.5422530509,,,,,36,AUS,2022/10/28,24,63461493,63461493
Australia,10/29/22,10376653,15660,,,1178,,40757.169173242415,,,,,36,AUS,2022/10/29,0,0,
Australia,10/29/22,10376653,15660,,,1178,,40757.169173242415,,,,,36,AUS,2022/10/29,0,63461493,63461493
Australia,10/30/22,10377788,15660,,,1135,,40761.627199063616,,,,,36,AUS,2022/10/30,0,0,
Australia,10/30/22,10377788,15660,,,1135,,40761.627199063616,,,,,36,AUS,2022/10/30,0,63461493,63461493
Australia,10/31/22,10379442,15665,,,1654,,40768.1237406568,,,,,36,AUS,2022/10/31,5,0,
Australia,10/31/22,10379442,15665,,,1654,,40768.1237406568,,,,,36,AUS,2022/10/31,5,63461493,63461493
Australia,11/1/22,10381125,15665,,,1683,,40774.73418775555,,,,,36,AUS,2022/11/01,0,0,
Australia,11/1/22,10381125,15665,,,1683,,40774.73418775555,,,,,36,AUS,2022/11/01,0,63461493,63461493
Australia,11/2/22,10383005,15678,,,1880,,40782.118406736925,,,,,36,AUS,2022/11/02,13,0,
Australia,11/2/22,10383005,15678,,,1880,,40782.118406736925,,,,,36,AUS,2022/11/02,13,63461493,63461493
Australia,11/3/22,10402713,15721,,,19708,,40859.52701720758,,,,,36,AUS,2022/11/03,43,0,
Australia,11/3/22,10402713,15721,,,19708,,40859.52701720758,,,,,36,AUS,2022/11/03,43,63461493,63461493
Australia,11/4/22,10417273,15786,,,14560,,40916.71543655267,,,,,36,AUS,2022/11/04,65,0,
Australia,11/4/22,10417273,15786,,,14560,,40916.71543655267,,,,,36,AUS,2022/11/04,65,63461493,63461493
Australia,11/5/22,10418986,15786,,,1713,,40923.443716933034,,,,,36,AUS,2022/11/05,0,0,
Australia,11/5/22,10418986,15786,,,1713,,40923.443716933034,,,,,36,AUS,2022/11/05,0,63461493,63461493
Australia,11/6/22,10420857,15786,,,1871,,40930.79258592992,,,,,36,AUS,2022/11/06,0,0,
Australia,11/6/22,10420857,15786,,,1871,,40930.79258592992,,,,,36,AUS,2022/11/06,0,63461493,63461493
Australia,11/7/22,10423566,15792,,,2709,,40941.432931259995,,,,,36,AUS,2022/11/07,6,0,
Australia,11/7/22,10423566,15792,,,2709,,40941.432931259995,,,,,36,AUS,2022/11/07,6,63461493,63461493
Australia,11/8/22,10426939,15808,,,3373,,40954.68131988987,,,,,36,AUS,2022/11/08,16,0,
Australia,11/8/22,10426939,15808,,,3373,,40954.68131988987,,,,,36,AUS,2022/11/08,16,63461493,63461493
Australia,11/9/22,10429996,15817,,,3057,,40966.6885312867,,,,,36,AUS,2022/11/09,9,0,
Australia,11/9/22,10429996,15817,,,3057,,40966.6885312867,,,,,36,AUS,2022/11/09,9,63461493,63461493
Australia,11/10/22,10458954,15855,,,28958,,41080.429070256134,,,,,36,AUS,2022/11/10,38,,
Australia,11/11/22,10472100,15873,,,13146,,41132.06361426097,,,,,36,AUS,2022/11/11,18,,
Australia,11/12/22,10479214,15870,,,7114,,41160.00581310856,,,,,36,AUS,2022/11/12,,,
Australia,11/13/22,10484025,15870,,,4811,,41178.90234370397,,,,,36,AUS,2022/11/13,0,,
Australia,11/14/22,10487217,15881,,,3192,,41191.43980486809,,,,,36,AUS,2022/11/14,11,,
Austria,10/18/22,5356174,20943,,,9235,,59470.75413039616,,,,,40,AUT,2022/10/18,15,0,
Austria,10/18/22,5356174,20943,,,9235,,59470.75413039616,,,,,40,AUT,2022/10/18,15,19613671,19613671
Austria,10/19/22,5369885,20953,,,13711,,59622.99031799609,,,,,40,AUT,2022/10/19,10,0,
Austria,10/19/22,5369885,20953,,,13711,,59622.99031799609,,,,,40,AUT,2022/10/19,10,19634004,19634004
Austria,10/20/22,5379734,20971,,,9849,,59732.34588736898,,,,,40,AUT,2022/10/20,18,0,
Austria,10/20/22,5379734,20971,,,9849,,59732.34588736898,,,,,40,AUT,2022/10/20,18,19658112,19658112
Austria,10/21/22,5387830,20980,,,8096,,59822.237519985785,,,,,40,AUT,2022/10/21,9,0,
Austria,10/21/22,5387830,20980,,,8096,,59822.237519985785,,,,,40,AUT,2022/10/21,9,19682504,19682504
Austria,10/24/22,5402162,20899,,,14332,,59981.368804405756,,,,,40,AUT,2022/10/24,,0,
Austria,10/24/22,5402162,20899,,,14332,,59981.368804405756,,,,,40,AUT,2022/10/24,,19720130,19720130
Austria,10/25/22,5408648,20922,,,6486,,60053.38426008172,,,,,40,AUT,2022/10/25,23,0,
Austria,10/25/22,5408648,20922,,,6486,,60053.38426008172,,,,,40,AUT,2022/10/25,23,19733769,19733769
Austria,10/26/22,5416866,20943,,,8218,,60144.630484988455,,,,,40,AUT,2022/10/26,21,0,
Austria,10/26/22,5416866,20943,,,8218,,60144.630484988455,,,,,40,AUT,2022/10/26,21,19751499,19751499
Austria,10/27/22,5421306,20946,,,4440,,60193.928761769406,,,,,40,AUT,2022/10/27,3,0,
Austria,10/27/22,5421306,20946,,,4440,,60193.928761769406,,,,,40,AUT,2022/10/27,3,19754893,19754893
Austria,10/28/22,5426408,20963,,,5102,,60250.577367205544,,,,,40,AUT,2022/10/28,17,0,
Austria,10/28/22,5426408,20963,,,5102,,60250.577367205544,,,,,40,AUT,2022/10/28,17,19768871,19768871
Austria,10/29/22,5432162,20976,,,5754,,60314.46526914195,,,,,40,AUT,2022/10/29,13,0,
Austria,10/29/22,5432162,20976,,,5754,,60314.46526914195,,,,,40,AUT,2022/10/29,13,19787008,19787008
Austria,10/30/22,5436721,20979,,,4559,,60365.08482856635,,,,,40,AUT,2022/10/30,3,0,
Austria,10/30/22,5436721,20979,,,4559,,60365.08482856635,,,,,40,AUT,2022/10/30,3,19787008,19787008
Austria,10/31/22,5439567,20981,,,2846,,60396.68457985433,,,,,40,AUT,2022/10/31,2,0,
Austria,10/31/22,5439567,20981,,,2846,,60396.68457985433,,,,,40,AUT,2022/10/31,2,19794008,19794008
Austria,11/1/22,5443883,20990,,,4316,,60444.606057914374,,,,,40,AUT,2022/11/01,9,0,
Austria,11/1/22,5443883,20990,,,4316,,60444.606057914374,,,,,40,AUT,2022/11/01,9,19794008,19794008
Austria,11/2/22,5448375,20990,,,4492,,60494.48170190087,,,,,40,AUT,2022/11/02,0,0,
Austria,11/2/22,5448375,20990,,,4492,,60494.48170190087,,,,,40,AUT,2022/11/02,0,19803561,19803561
Austria,11/3/22,5453038,21012,,,4663,,60546.25599573636,,,,,40,AUT,2022/11/03,22,0,
Austria,11/3/22,5453038,21012,,,4663,,60546.25599573636,,,,,40,AUT,2022/11/03,22,19817971,19817971
Austria,11/4/22,5458604,21029,,,5566,,60608.05649316042,,,,,40,AUT,2022/11/04,17,0,
Austria,11/4/22,5458604,21029,,,5566,,60608.05649316042,,,,,40,AUT,2022/11/04,17,19836498,19836498
Austria,11/5/22,5462911,21036,,,4307,,60655.878042281045,,,,,40,AUT,2022/11/05,7,0,
Austria,11/5/22,5462911,21036,,,4307,,60655.878042281045,,,,,40,AUT,2022/11/05,7,19836498,19836498
Austria,11/6/22,5466250,21037,,,3339,,60692.95167880618,,,,,40,AUT,2022/11/06,1,0,
Austria,11/6/22,5466250,21037,,,3339,,60692.95167880618,,,,,40,AUT,2022/11/06,1,19866400,19866400
Austria,11/7/22,5468967,21040,,,2717,,60723.11911529579,,,,,40,AUT,2022/11/07,3,0,
Austria,11/7/22,5468967,21040,,,2717,,60723.11911529579,,,,,40,AUT,2022/11/07,3,19867548,19867548
Austria,11/8/22,5472671,21049,,,3704,,60764.245425475216,,,,,40,AUT,2022/11/08,9,0,
Austria,11/8/22,5472671,21049,,,3704,,60764.245425475216,,,,,40,AUT,2022/11/08,9,19878234,19878234
Austria,11/9/22,5477350,21059,,,4679,,60816.19737075857,,,,,40,AUT,2022/11/09,10,0,
Austria,11/9/22,5477350,21059,,,4679,,60816.19737075857,,,,,40,AUT,2022/11/09,10,19894719,19894719
Austria,11/10/22,5481274,21069,,,3924,,60859.76638834606,,,,,40,AUT,2022/11/10,10,,
Austria,11/11/22,5484553,21082,,,3279,,60896.17383194173,,,,,40,AUT,2022/11/11,13,,
Austria,11/12/22,5488376,21090,,,3823,,60938.62142476461,,,,,40,AUT,2022/11/12,8,,
Austria,11/13/22,5491252,21093,,,2876,,60970.55427251732,,,,,40,AUT,2022/11/13,3,,
Austria,11/14/22,5493469,21094,,,2217,,60995.17010126133,,,,,40,AUT,2022/11/14,1,,
Azerbaijan,10/18/22,822686,9935,,,69,,8113.934319113735,,,,,31,AZE,2022/10/18,3,0,
Azerbaijan,10/18/22,822686,9935,,,69,,8113.934319113735,,,,,31,AZE,2022/10/18,3,13857111,13857111
Azerbaijan,10/19/22,822751,9935,,,65,,8114.575396913457,,,,,31,AZE,2022/10/19,0,0,
Azerbaijan,10/19/22,822751,9935,,,65,,8114.575396913457,,,,,31,AZE,2022/10/19,0,13857111,13857111
Azerbaijan,10/20/22,822805,9935,,,54,,8115.107984623995,,,,,31,AZE,2022/10/20,0,0,
Azerbaijan,10/20/22,822805,9935,,,54,,8115.107984623995,,,,,31,AZE,2022/10/20,0,13857111,13857111
Azerbaijan,10/21/22,822852,9935,,,47,,8115.571533186871,,,,,31,AZE,2022/10/21,0,0,
Azerbaijan,10/21/22,822852,9935,,,47,,8115.571533186871,,,,,31,AZE,2022/10/21,0,13857111,13857111
Azerbaijan,10/22/22,822908,9937,,,56,,8116.123846368171,,,,,31,AZE,2022/10/22,2,0,
Azerbaijan,10/22/22,822908,9937,,,56,,8116.123846368171,,,,,31,AZE,2022/10/22,2,13857111,13857111
Azerbaijan,10/23/22,822954,9937,,,46,,8116.577532195667,,,,,31,AZE,2022/10/23,0,0,
Azerbaijan,10/23/22,822954,9937,,,46,,8116.577532195667,,,,,31,AZE,2022/10/23,0,13857111,13857111
Azerbaijan,10/24/22,822959,9937,,,5,,8116.626845872568,,,,,31,AZE,2022/10/24,0,0,
Azerbaijan,10/24/22,822959,9937,,,5,,8116.626845872568,,,,,31,AZE,2022/10/24,0,13857111,13857111
Azerbaijan,10/25/22,823023,9940,,,64,,8117.258060936911,,,,,31,AZE,2022/10/25,3,0,
Azerbaijan,10/25/22,823023,9940,,,64,,8117.258060936911,,,,,31,AZE,2022/10/25,3,13857111,13857111
Azerbaijan,10/26/22,823064,9941,,,41,,8117.662433087505,,,,,31,AZE,2022/10/26,1,0,
Azerbaijan,10/26/22,823064,9941,,,41,,8117.662433087505,,,,,31,AZE,2022/10/26,1,13857111,13857111
Azerbaijan,10/27/22,823100,9942,,,36,,8118.017491561197,,,,,31,AZE,2022/10/27,1,0,
Azerbaijan,10/27/22,823100,9942,,,36,,8118.017491561197,,,,,31,AZE,2022/10/27,1,13857111,13857111
Azerbaijan,10/28/22,823149,9943,,,49,,8118.500765594834,,,,,31,AZE,2022/10/28,1,0,
Azerbaijan,10/28/22,823149,9943,,,49,,8118.500765594834,,,,,31,AZE,2022/10/28,1,13857111,13857111
Azerbaijan,10/29/22,823202,9944,,,53,,8119.023490569992,,,,,31,AZE,2022/10/29,1,0,
Azerbaijan,10/29/22,823202,9944,,,53,,8119.023490569992,,,,,31,AZE,2022/10/29,1,13857111,13857111
Azerbaijan,10/30/22,823247,9944,,,45,,8119.467313662108,,,,,31,AZE,2022/10/30,0,0,
Azerbaijan,10/30/22,823247,9944,,,45,,8119.467313662108,,,,,31,AZE,2022/10/30,0,13857111,13857111
Azerbaijan,10/31/22,823258,9944,,,11,,8119.5758037512915,,,,,31,AZE,2022/10/31,0,0,
Azerbaijan,10/31/22,823258,9944,,,11,,8119.5758037512915,,,,,31,AZE,2022/10/31,0,13857111,13857111
Azerbaijan,11/1/22,823318,9948,,,60,,8120.167567874112,,,,,31,AZE,2022/11/01,4,0,
Azerbaijan,11/1/22,823318,9948,,,60,,8120.167567874112,,,,,31,AZE,2022/11/01,4,13857111,13857111
Azerbaijan,11/2/22,823369,9951,,,51,,8120.67056737851,,,,,31,AZE,2022/11/02,3,0,
Azerbaijan,11/2/22,823369,9951,,,51,,8120.67056737851,,,,,31,AZE,2022/11/02,3,13857111,13857111
Azerbaijan,11/3/22,823418,9951,,,49,,8121.153841412147,,,,,31,AZE,2022/11/03,0,0,
Azerbaijan,11/3/22,823418,9951,,,49,,8121.153841412147,,,,,31,AZE,2022/11/03,0,13857111,13857111
Azerbaijan,11/4/22,823469,9953,,,51,,8121.656840916544,,,,,31,AZE,2022/11/04,2,0,
Azerbaijan,11/4/22,823469,9953,,,51,,8121.656840916544,,,,,31,AZE,2022/11/04,2,13857111,13857111
Azerbaijan,11/5/22,823496,9955,,,27,,8121.923134771813,,,,,31,AZE,2022/11/05,2,0,
Azerbaijan,11/5/22,823496,9955,,,27,,8121.923134771813,,,,,31,AZE,2022/11/05,2,13857111,13857111
Azerbaijan,11/6/22,823533,9957,,,37,,8122.288055980886,,,,,31,AZE,2022/11/06,2,0,
Azerbaijan,11/6/22,823533,9957,,,37,,8122.288055980886,,,,,31,AZE,2022/11/06,2,13857111,13857111
Azerbaijan,11/7/22,823539,9957,,,6,,8122.347232393168,,,,,31,AZE,2022/11/07,0,0,
Azerbaijan,11/7/22,823539,9957,,,6,,8122.347232393168,,,,,31,AZE,2022/11/07,0,13857111,13857111
Azerbaijan,11/8/22,823577,9957,,,38,,8122.722016337621,,,,,31,AZE,2022/11/08,0,0,
Azerbaijan,11/8/22,823577,9957,,,38,,8122.722016337621,,,,,31,AZE,2022/11/08,0,13857111,13857111
Azerbaijan,11/9/22,823584,9957,,,7,,8122.791055485283,,,,,31,AZE,2022/11/09,0,0,
Azerbaijan,11/9/22,823584,9957,,,7,,8122.791055485283,,,,,31,AZE,2022/11/09,0,13857111,13857111
Azerbaijan,11/10/22,823592,9957,,,8,,8122.869957368326,,,,,31,AZE,2022/11/10,0,,
Azerbaijan,11/11/22,823636,9959,,,44,,8123.303917725061,,,,,31,AZE,2022/11/11,2,,
Azerbaijan,11/12/22,823688,9961,,,52,,8123.816779964839,,,,,31,AZE,2022/11/12,2,,
Azerbaijan,11/13/22,823721,9963,,,33,,8124.14225023239,,,,,31,AZE,2022/11/13,2,,
Azerbaijan,11/14/22,823725,9964,,,4,,8124.181701173912,,,,,31,AZE,2022/11/14,1,,
Bahamas,10/18/22,37334,833,,,0,,9493.75457726422,,,,,44,BHS,2022/10/18,0,0,
Bahamas,10/18/22,37334,833,,,0,,9493.75457726422,,,,,44,BHS,2022/10/18,0,362109,362109
Bahamas,10/20/22,37342,833,,,8,,9495.788916917569,,,,,44,BHS,2022/10/20,0,0,
Bahamas,10/20/22,37342,833,,,8,,9495.788916917569,,,,,44,BHS,2022/10/20,0,362109,362109
Bahamas,10/24/22,37364,833,,,22,,9501.383350964277,,,,,44,BHS,2022/10/24,0,0,
Bahamas,10/24/22,37364,833,,,22,,9501.383350964277,,,,,44,BHS,2022/10/24,0,362968,362968
Bahamas,10/27/22,37369,833,,,5,,9502.65481324762,,,,,44,BHS,2022/10/27,0,0,
Bahamas,10/27/22,37369,833,,,5,,9502.65481324762,,,,,44,BHS,2022/10/27,0,362968,362968
Bahamas,10/30/22,37386,833,,,17,,9506.977785010986,,,,,44,BHS,2022/10/30,0,0,
Bahamas,10/30/22,37386,833,,,17,,9506.977785010986,,,,,44,BHS,2022/10/30,0,362968,362968
Bahamas,11/8/22,37416,833,,,30,,9514.606558711042,,,,,44,BHS,2022/11/08,0,0,
Bahamas,11/8/22,37416,833,,,30,,9514.606558711042,,,,,44,BHS,2022/11/08,0,362968,362968
Bahamas,11/10/22,37429,833,,,13,,9517.912360647733,,,,,44,BHS,2022/11/10,0,,
Bahamas,11/11/22,37433,833,,,4,,9518.929530474408,,,,,44,BHS,2022/11/11,0,,
Bahamas,11/13/22,37436,833,,,3,,9519.692407844414,,,,,44,BHS,2022/11/13,0,,
Bahamas,11/14/22,37436,833,,,0,,9519.692407844414,,,,,44,BHS,2022/11/14,0,,
Bahrain,10/18/22,686317,1523,,,348,,40334.030135467976,,,,,48,BHR,2022/10/18,0,0,
Bahrain,10/18/22,686317,1523,,,348,,40334.030135467976,,,,,48,BHR,2022/10/18,0,3472679,3472679
Bahrain,10/19/22,686629,1523,,,312,,40352.36600271629,,,,,48,BHR,2022/10/19,0,0,
Bahrain,10/19/22,686629,1523,,,312,,40352.36600271629,,,,,48,BHR,2022/10/19,0,3472758,3472758
Bahrain,10/20/22,686932,1523,,,303,,40370.17295071707,,,,,48,BHR,2022/10/20,0,0,
Bahrain,10/20/22,686932,1523,,,303,,40370.17295071707,,,,,48,BHR,2022/10/20,0,3472876,3472876
Bahrain,10/21/22,687146,1524,,,214,,40382.74947504765,,,,,48,BHR,2022/10/21,1,0,
Bahrain,10/21/22,687146,1524,,,214,,40382.74947504765,,,,,48,BHR,2022/10/21,1,3472956,3472956
Bahrain,10/22/22,687353,1524,,,207,,40394.91461774125,,,,,48,BHR,2022/10/22,0,0,
Bahrain,10/22/22,687353,1524,,,207,,40394.91461774125,,,,,48,BHR,2022/10/22,0,3473000,3473000
Bahrain,10/23/22,687591,1524,,,238,,40408.901593398616,,,,,48,BHR,2022/10/23,0,0,
Bahrain,10/23/22,687591,1524,,,238,,40408.901593398616,,,,,48,BHR,2022/10/23,0,3473111,3473111
Bahrain,10/24/22,688044,1524,,,453,,40435.523862191854,,,,,48,BHR,2022/10/24,0,0,
Bahrain,10/24/22,688044,1524,,,453,,40435.523862191854,,,,,48,BHR,2022/10/24,0,3473218,3473218
Bahrain,10/25/22,688359,1524,,,315,,40454.03603585602,,,,,48,BHR,2022/10/25,0,0,
Bahrain,10/25/22,688359,1524,,,315,,40454.03603585602,,,,,48,BHR,2022/10/25,0,3473312,3473312
Bahrain,10/26/22,688646,1524,,,287,,40470.902682972264,,,,,48,BHR,2022/10/26,0,0,
Bahrain,10/26/22,688646,1524,,,287,,40470.902682972264,,,,,48,BHR,2022/10/26,0,3473406,3473406
Bahrain,10/27/22,689013,1524,,,367,,40492.47083451116,,,,,48,BHR,2022/10/27,0,0,
Bahrain,10/27/22,689013,1524,,,367,,40492.47083451116,,,,,48,BHR,2022/10/27,0,3473529,3473529
Bahrain,10/28/22,689256,1527,,,243,,40506.751654194944,,,,,48,BHR,2022/10/28,3,0,
Bahrain,10/28/22,689256,1527,,,243,,40506.751654194944,,,,,48,BHR,2022/10/28,3,3473578,3473578
Bahrain,10/29/22,689480,1527,,,224,,40519.915866578354,,,,,48,BHR,2022/10/29,0,0,
Bahrain,10/29/22,689480,1527,,,224,,40519.915866578354,,,,,48,BHR,2022/10/29,0,3473606,3473606
Bahrain,10/30/22,689820,1527,,,340,,40539.8972603746,,,,,48,BHR,2022/10/30,0,0,
Bahrain,10/30/22,689820,1527,,,340,,40539.8972603746,,,,,48,BHR,2022/10/30,0,3473606,3473606
Bahrain,10/31/22,690187,1528,,,367,,40561.465411913494,,,,,48,BHR,2022/10/31,1,0,
Bahrain,10/31/22,690187,1528,,,367,,40561.465411913494,,,,,48,BHR,2022/10/31,1,3473779,3473779
Bahrain,11/1/22,690401,1529,,,214,,40574.04193624407,,,,,48,BHR,2022/11/01,1,0,
Bahrain,11/1/22,690401,1529,,,214,,40574.04193624407,,,,,48,BHR,2022/11/01,1,3473855,3473855
Bahrain,11/2/22,690760,1529,,,359,,40595.1399373407,,,,,48,BHR,2022/11/02,0,0,
Bahrain,11/2/22,690760,1529,,,359,,40595.1399373407,,,,,48,BHR,2022/11/02,0,3473923,3473923
Bahrain,11/3/22,691074,1529,,,314,,40613.59334219959,,,,,48,BHR,2022/11/03,0,0,
Bahrain,11/3/22,691074,1529,,,314,,40613.59334219959,,,,,48,BHR,2022/11/03,0,3474002,3474002
Bahrain,11/4/22,691300,1529,,,226,,40626.875092193564,,,,,48,BHR,2022/11/04,0,0,
Bahrain,11/4/22,691300,1529,,,226,,40626.875092193564,,,,,48,BHR,2022/11/04,0,3474086,3474086
Bahrain,11/5/22,691509,1529,,,209,,40639.157772497725,,,,,48,BHR,2022/11/05,0,0,
Bahrain,11/5/22,691509,1529,,,209,,40639.157772497725,,,,,48,BHR,2022/11/05,0,3474118,3474118
Bahrain,11/6/22,691760,1529,,,251,,40653.90874262378,,,,,48,BHR,2022/11/06,0,0,
Bahrain,11/6/22,691760,1529,,,251,,40653.90874262378,,,,,48,BHR,2022/11/06,0,3474226,3474226
Bahrain,11/7/22,692129,1529,,,369,,40675.594431773236,,,,,48,BHR,2022/11/07,0,0,
Bahrain,11/7/22,692129,1529,,,369,,40675.594431773236,,,,,48,BHR,2022/11/07,0,3474324,3474324
Bahrain,11/8/22,692378,1529,,,249,,40690.227864288725,,,,,48,BHR,2022/11/08,0,0,
Bahrain,11/8/22,692378,1529,,,249,,40690.227864288725,,,,,48,BHR,2022/11/08,0,3474412,3474412
Bahrain,11/9/22,692639,1530,,,261,,40705.566522467605,,,,,48,BHR,2022/11/09,1,0,
Bahrain,11/9/22,692639,1530,,,261,,40705.566522467605,,,,,48,BHR,2022/11/09,1,3474497,3474497
Bahrain,11/10/22,692885,1531,,,246,,40720.02364856724,,,,,48,BHR,2022/11/10,1,,
Bahrain,11/11/22,693082,1531,,,197,,40731.60110320801,,,,,48,BHR,2022/11/11,0,,
Bahrain,11/12/22,693261,1531,,,179,,40742.12071935368,,,,,48,BHR,2022/11/12,0,,
Bahrain,11/13/22,693492,1532,,,231,,40755.69631337408,,,,,48,BHR,2022/11/13,1,,
Bahrain,11/14/22,693725,1532,,,233,,40769.389445005036,,,,,48,BHR,2022/11/14,0,,
Bangladesh,10/18/22,2033119,29408,,,287,,1234.5173459056557,,,,,50,BGD,2022/10/18,6,0,
Bangladesh,10/18/22,2033119,29408,,,287,,1234.5173459056557,,,,,50,BGD,2022/10/18,6,315846938,315846938
Bangladesh,10/19/22,2033419,29410,,,300,,1234.699507010722,,,,,50,BGD,2022/10/19,2,0,
Bangladesh,10/19/22,2033419,29410,,,300,,1234.699507010722,,,,,50,BGD,2022/10/19,2,315846938,315846938
Bangladesh,10/20/22,2033662,29411,,,243,,1234.847057505826,,,,,50,BGD,2022/10/20,1,0,
Bangladesh,10/20/22,2033662,29411,,,243,,1234.847057505826,,,,,50,BGD,2022/10/20,1,317662248,317662248
Bangladesh,10/21/22,2033878,29411,,,216,,1234.9782135014739,,,,,50,BGD,2022/10/21,0,0,
Bangladesh,10/21/22,2033878,29411,,,216,,1234.9782135014739,,,,,50,BGD,2022/10/21,0,317662248,317662248
Bangladesh,10/22/22,2034002,29412,,,124,,1235.0535067582348,,,,,50,BGD,2022/10/22,1,0,
Bangladesh,10/22/22,2034002,29412,,,124,,1235.0535067582348,,,,,50,BGD,2022/10/22,1,317662248,317662248
Bangladesh,10/23/22,2034141,29413,,,139,,1235.1379080702488,,,,,50,BGD,2022/10/23,1,0,
Bangladesh,10/23/22,2034141,29413,,,139,,1235.1379080702488,,,,,50,BGD,2022/10/23,1,317662248,317662248
Bangladesh,10/24/22,2034348,29415,,,207,,1235.2635992327448,,,,,50,BGD,2022/10/24,2,0,
Bangladesh,10/24/22,2034348,29415,,,207,,1235.2635992327448,,,,,50,BGD,2022/10/24,2,317662248,317662248
Bangladesh,10/25/22,2034533,29416,,,185,,1235.3759319142023,,,,,50,BGD,2022/10/25,1,0,
Bangladesh,10/25/22,2034533,29416,,,185,,1235.3759319142023,,,,,50,BGD,2022/10/25,1,317662248,317662248
Bangladesh,10/26/22,2034729,29416,,,196,,1235.4949438361791,,,,,50,BGD,2022/10/26,0,0,
Bangladesh,10/26/22,2034729,29416,,,196,,1235.4949438361791,,,,,50,BGD,2022/10/26,0,318255850,318255850
Bangladesh,10/27/22,2034866,29417,,,137,,1235.5781307408263,,,,,50,BGD,2022/10/27,1,0,
Bangladesh,10/27/22,2034866,29417,,,137,,1235.5781307408263,,,,,50,BGD,2022/10/27,1,318255850,318255850
Bangladesh,10/28/22,2034968,29418,,,102,,1235.6400655165487,,,,,50,BGD,2022/10/28,1,0,
Bangladesh,10/28/22,2034968,29418,,,102,,1235.6400655165487,,,,,50,BGD,2022/10/28,1,318255850,318255850
Bangladesh,10/29/22,2035037,29419,,,69,,1235.6819625707142,,,,,50,BGD,2022/10/29,1,0,
Bangladesh,10/29/22,2035037,29419,,,69,,1235.6819625707142,,,,,50,BGD,2022/10/29,1,318727301,318727301
Bangladesh,10/30/22,2035152,29423,,,115,,1235.7517909943228,,,,,50,BGD,2022/10/30,4,0,
Bangladesh,10/30/22,2035152,29423,,,115,,1235.7517909943228,,,,,50,BGD,2022/10/30,4,318727301,318727301
Bangladesh,10/31/22,2035240,29423,,,88,,1235.8052249184757,,,,,50,BGD,2022/10/31,0,0,
Bangladesh,10/31/22,2035240,29423,,,88,,1235.8052249184757,,,,,50,BGD,2022/10/31,0,320611510,320611510
Bangladesh,11/1/22,2035334,29424,,,94,,1235.8623020647299,,,,,50,BGD,2022/11/01,1,0,
Bangladesh,11/1/22,2035334,29424,,,94,,1235.8623020647299,,,,,50,BGD,2022/11/01,1,321697150,321697150
Bangladesh,11/2/22,2035517,29424,,,183,,1235.9734203388205,,,,,50,BGD,2022/11/02,0,0,
Bangladesh,11/2/22,2035517,29424,,,183,,1235.9734203388205,,,,,50,BGD,2022/11/02,0,321697150,321697150
Bangladesh,11/3/22,2035657,29425,,,140,,1236.0584288545183,,,,,50,BGD,2022/11/03,1,0,
Bangladesh,11/3/22,2035657,29425,,,140,,1236.0584288545183,,,,,50,BGD,2022/11/03,1,321697150,321697150
Bangladesh,11/4/22,2035745,29425,,,88,,1236.1118627786711,,,,,50,BGD,2022/11/04,0,0,
Bangladesh,11/4/22,2035745,29425,,,88,,1236.1118627786711,,,,,50,BGD,2022/11/04,0,321697150,321697150
Bangladesh,11/5/22,2035782,29425,,,37,,1236.1343293149625,,,,,50,BGD,2022/11/05,0,0,
Bangladesh,11/5/22,2035782,29425,,,37,,1236.1343293149625,,,,,50,BGD,2022/11/05,0,323543778,323543778
Bangladesh,11/6/22,2035828,29426,,,46,,1236.1622606844062,,,,,50,BGD,2022/11/06,1,0,
Bangladesh,11/6/22,2035828,29426,,,46,,1236.1622606844062,,,,,50,BGD,2022/11/06,1,323543778,323543778
Bangladesh,11/7/22,2035882,29426,,,54,,1236.195049683318,,,,,50,BGD,2022/11/07,0,0,
Bangladesh,11/7/22,2035882,29426,,,54,,1236.195049683318,,,,,50,BGD,2022/11/07,0,323543778,323543778
Bangladesh,11/8/22,2035930,29426,,,48,,1236.2241954601286,,,,,50,BGD,2022/11/08,0,0,
Bangladesh,11/8/22,2035930,29426,,,48,,1236.2241954601286,,,,,50,BGD,2022/11/08,0,324273039,324273039
Bangladesh,11/9/22,2035992,29426,,,62,,1236.2618420885092,,,,,50,BGD,2022/11/09,0,0,
Bangladesh,11/9/22,2035992,29426,,,62,,1236.2618420885092,,,,,50,BGD,2022/11/09,0,325402861,325402861
Bangladesh,11/10/22,2036061,29426,,,69,,1236.3037391426744,,,,,50,BGD,2022/11/10,0,,
Bangladesh,11/11/22,2036109,29426,,,48,,1236.332884919485,,,,,50,BGD,2022/11/11,0,,
Bangladesh,11/12/22,2036131,29426,,,22,,1236.3462434005232,,,,,50,BGD,2022/11/12,0,,
Bangladesh,11/13/22,2036166,29427,,,35,,1236.3674955294478,,,,,50,BGD,2022/11/13,1,,
Bangladesh,11/14/22,2036204,29429,,,38,,1236.3905692694227,,,,,50,BGD,2022/11/14,2,,
Barbados,10/18/22,103014,560,,,0,,35847.04093314913,,,,,52,BRB,2022/10/18,0,0,
Barbados,10/18/22,103014,560,,,0,,35847.04093314913,,,,,52,BRB,2022/10/18,0,379843,379843
Barbados,11/1/22,103424,560,,,410,,35989.71364542699,,,,,52,BRB,2022/11/01,0,0,
Barbados,11/1/22,103424,560,,,410,,35989.71364542699,,,,,52,BRB,2022/11/01,0,380666,380666
Barbados,11/14/22,103424,560,,,0,,35989.71364542699,,,,,52,BRB,2022/11/14,0,,
Belarus,10/18/22,994037,7118,,,0,,10519.665910386577,,,,,112,BLR,2022/10/18,0,0,
Belarus,10/18/22,994037,7118,,,0,,10519.665910386577,,,,,112,BLR,2022/10/18,0,15754625,15754625
Belarus,11/14/22,994037,7118,,,0,,10519.665910386577,,,,,112,BLR,2022/11/14,0,,
Belgium,10/18/22,4594338,32810,,,0,,39641.84835804741,,,,,56,BEL,2022/10/18,0,0,
Belgium,10/18/22,4594338,32810,,,0,,39641.84835804741,,,,,56,BEL,2022/10/18,0,28612369,28612369
Belgium,10/20/22,4602438,32846,,,8100,,39711.73850798853,,,,,56,BEL,2022/10/20,36,0,
Belgium,10/20/22,4602438,32846,,,8100,,39711.73850798853,,,,,56,BEL,2022/10/20,36,28782590,28782590
Belgium,10/24/22,4607296,32883,,,4858,,39753.655341126054,,,,,56,BEL,2022/10/24,37,0,
Belgium,10/24/22,4607296,32883,,,4858,,39753.655341126054,,,,,56,BEL,2022/10/24,37,28995382,28995382
Belgium,10/27/22,4612239,32902,,,4943,,39796.30558941729,,,,,56,BEL,2022/10/27,19,0,
Belgium,10/27/22,4612239,32902,,,4943,,39796.30558941729,,,,,56,BEL,2022/10/27,19,29114867,29114867
Belgium,11/3/22,4617315,32941,,,5076,,39840.10341671372,,,,,56,BEL,2022/11/03,39,0,
Belgium,11/3/22,4617315,32941,,,5076,,39840.10341671372,,,,,56,BEL,2022/11/03,39,29297632,29297632
Belgium,11/7/22,4619721,32959,,,2406,,39860.86337977031,,,,,56,BEL,2022/11/07,18,0,
Belgium,11/7/22,4619721,32959,,,2406,,39860.86337977031,,,,,56,BEL,2022/11/07,18,29352415,29352415
Belgium,11/10/22,4622723,32976,,,3002,,39886.765877316386,,,,,56,BEL,2022/11/10,17,,
Belgium,11/14/22,4624251,33000,,,1528,,39899.950093255895,,,,,56,BEL,2022/11/14,24,,
Belize,10/18/22,68926,687,,,0,,17334.59751874272,,,,,84,BLZ,2022/10/18,0,0,
Belize,10/18/22,68926,687,,,0,,17334.59751874272,,,,,84,BLZ,2022/10/18,0,501100,501100
Belize,10/24/22,68943,687,,,17,,17338.8729468514,,,,,84,BLZ,2022/10/24,0,0,
Belize,10/24/22,68943,687,,,17,,17338.8729468514,,,,,84,BLZ,2022/10/24,0,501240,501240
Belize,11/1/22,68957,687,,,14,,17342.39388764678,,,,,84,BLZ,2022/11/01,0,0,
Belize,11/1/22,68957,687,,,14,,17342.39388764678,,,,,84,BLZ,2022/11/01,0,501313,501313
Belize,11/7/22,68972,687,,,15,,17346.16632421326,,,,,84,BLZ,2022/11/07,0,0,
Belize,11/7/22,68972,687,,,15,,17346.16632421326,,,,,84,BLZ,2022/11/07,0,501313,501313
Belize,11/14/22,68988,687,,,16,,17350.190256550835,,,,,84,BLZ,2022/11/14,0,,
Benin,10/18/22,27782,163,,,0,,229.16395492344512,,,,,204,BEN,2022/10/18,0,0,
Benin,10/18/22,27782,163,,,0,,229.16395492344512,,,,,204,BEN,2022/10/18,0,3690703,3690703
Benin,11/7/22,27912,163,,,130,,230.23627923919085,,,,,204,BEN,2022/11/07,0,0,
Benin,11/7/22,27912,163,,,130,,230.23627923919085,,,,,204,BEN,2022/11/07,0,3690703,3690703
Benin,11/14/22,27922,163,,,10,,230.31876572501744,,,,,204,BEN,2022/11/14,0,,
Bhutan,10/18/22,62248,21,,,1,,8067.266968372705,,,,,64,BTN,2022/10/18,0,0,
Bhutan,10/18/22,62248,21,,,1,,8067.266968372705,,,,,64,BTN,2022/10/18,0,2007661,2007661
Bhutan,10/24/22,62331,21,,,83,,8078.023669927373,,,,,64,BTN,2022/10/24,0,0,
Bhutan,10/24/22,62331,21,,,83,,8078.023669927373,,,,,64,BTN,2022/10/24,0,2010132,2010132
Bhutan,10/31/22,62380,21,,,49,,8084.374011809044,,,,,64,BTN,2022/10/31,0,0,
Bhutan,10/31/22,62380,21,,,49,,8084.374011809044,,,,,64,BTN,2022/10/31,0,2010782,2010782
Bhutan,11/7/22,62430,21,,,50,,8090.853952504626,,,,,64,BTN,2022/11/07,0,0,
Bhutan,11/7/22,62430,21,,,50,,8090.853952504626,,,,,64,BTN,2022/11/07,0,2011426,2011426
Bhutan,11/14/22,62460,21,,,30,,8094.741916921977,,,,,64,BTN,2022/11/14,0,,
Bolivia,10/18/22,1109037,22237,,,0,,9500.850207773834,,,,,68,BOL,2022/10/18,0,0,
Bolivia,10/18/22,1109037,22237,,,0,,9500.850207773834,,,,,68,BOL,2022/10/18,0,15367403,15367403
Bolivia,10/19/22,1109123,22237,,,86,,9501.586948854492,,,,,68,BOL,2022/10/19,0,0,
Bolivia,10/19/22,1109123,22237,,,86,,9501.586948854492,,,,,68,BOL,2022/10/19,0,15367403,15367403
Bolivia,10/20/22,1109171,22237,,,48,,9501.99815317858,,,,,68,BOL,2022/10/20,0,0,
Bolivia,10/20/22,1109171,22237,,,48,,9501.99815317858,,,,,68,BOL,2022/10/20,0,15383699,15383699
Bolivia,10/23/22,1109238,22239,,,67,,9502.572125880952,,,,,68,BOL,2022/10/23,2,0,
Bolivia,10/23/22,1109238,22239,,,67,,9502.572125880952,,,,,68,BOL,2022/10/23,2,15383699,15383699
Bolivia,10/25/22,1109277,22239,,,39,,9502.906229394273,,,,,68,BOL,2022/10/25,0,0,
Bolivia,10/25/22,1109277,22239,,,39,,9502.906229394273,,,,,68,BOL,2022/10/25,0,15383699,15383699
Bolivia,10/26/22,1109309,22239,,,32,,9503.180365610331,,,,,68,BOL,2022/10/26,0,0,
Bolivia,10/26/22,1109309,22239,,,32,,9503.180365610331,,,,,68,BOL,2022/10/26,0,15417972,15417972
Bolivia,10/28/22,1109385,22239,,,76,,9503.83143912347,,,,,68,BOL,2022/10/28,0,0,
Bolivia,10/28/22,1109385,22239,,,76,,9503.83143912347,,,,,68,BOL,2022/10/28,0,15417972,15417972
Bolivia,10/30/22,1109447,22239,,,62,,9504.362578042083,,,,,68,BOL,2022/10/30,0,0,
Bolivia,10/30/22,1109447,22239,,,62,,9504.362578042083,,,,,68,BOL,2022/10/30,0,15417972,15417972
Bolivia,11/1/22,1109491,22239,,,44,,9504.739515339163,,,,,68,BOL,2022/11/01,0,0,
Bolivia,11/1/22,1109491,22239,,,44,,9504.739515339163,,,,,68,BOL,2022/11/01,0,15417972,15417972
Bolivia,11/3/22,1109512,22239,,,21,,9504.919417230953,,,,,68,BOL,2022/11/03,0,0,
Bolivia,11/3/22,1109512,22239,,,21,,9504.919417230953,,,,,68,BOL,2022/11/03,0,15448082,15448082
Bolivia,11/4/22,1109529,22239,,,17,,9505.065052095733,,,,,68,BOL,2022/11/04,0,0,
Bolivia,11/4/22,1109529,22239,,,17,,9505.065052095733,,,,,68,BOL,2022/11/04,0,15448082,15448082
Bolivia,11/5/22,1109581,22240,,,52,,9505.510523446828,,,,,68,BOL,2022/11/05,1,0,
Bolivia,11/5/22,1109581,22240,,,52,,9505.510523446828,,,,,68,BOL,2022/11/05,1,15448082,15448082
Bolivia,11/6/22,1109601,22240,,,20,,9505.681858581864,,,,,68,BOL,2022/11/06,0,0,
Bolivia,11/6/22,1109601,22240,,,20,,9505.681858581864,,,,,68,BOL,2022/11/06,0,15448082,15448082
Bolivia,11/7/22,1109652,22240,,,51,,9506.118763176208,,,,,68,BOL,2022/11/07,0,0,
Bolivia,11/7/22,1109652,22240,,,51,,9506.118763176208,,,,,68,BOL,2022/11/07,0,15448082,15448082
Bolivia,11/9/22,1109730,22241,,,78,,9506.78697020285,,,,,68,BOL,2022/11/09,1,0,
Bolivia,11/9/22,1109730,22241,,,78,,9506.78697020285,,,,,68,BOL,2022/11/09,1,15448082,15448082
Bolivia,11/11/22,1109763,22243,,,33,,9507.06967317566,,,,,68,BOL,2022/11/11,2,,
Bolivia,11/12/22,1109822,22243,,,59,,9507.575111824017,,,,,68,BOL,2022/11/12,0,,
Bolivia,11/14/22,1109838,22243,,,16,,9507.712179932047,,,,,68,BOL,2022/11/14,0,,
Bosnia and Herzegovina,10/18/22,399544,16160,,,45,,12178.193528132491,,,,,70,BIH,2022/10/18,0,0,
Bosnia and Herzegovina,10/18/22,399544,16160,,,45,,12178.193528132491,,,,,70,BIH,2022/10/18,0,1924950,1924950
Bosnia and Herzegovina,10/19/22,399584,16161,,,40,,12179.412737383851,,,,,70,BIH,2022/10/19,1,0,
Bosnia and Herzegovina,10/19/22,399584,16161,,,40,,12179.412737383851,,,,,70,BIH,2022/10/19,1,1924950,1924950
Bosnia and Herzegovina,10/20/22,399626,16164,,,42,,12180.692907097779,,,,,70,BIH,2022/10/20,3,0,
Bosnia and Herzegovina,10/20/22,399626,16164,,,42,,12180.692907097779,,,,,70,BIH,2022/10/20,3,1924950,1924950
Bosnia and Herzegovina,10/21/22,399663,16165,,,37,,12181.820675655286,,,,,70,BIH,2022/10/21,1,0,
Bosnia and Herzegovina,10/21/22,399663,16165,,,37,,12181.820675655286,,,,,70,BIH,2022/10/21,1,1924950,1924950
Bosnia and Herzegovina,10/24/22,399719,16166,,,56,,12183.527568607191,,,,,70,BIH,2022/10/24,1,0,
Bosnia and Herzegovina,10/24/22,399719,16166,,,56,,12183.527568607191,,,,,70,BIH,2022/10/24,1,1924950,1924950
Bosnia and Herzegovina,10/25/22,399784,16167,,,65,,12185.508783640651,,,,,70,BIH,2022/10/25,1,0,
Bosnia and Herzegovina,10/25/22,399784,16167,,,65,,12185.508783640651,,,,,70,BIH,2022/10/25,1,1924950,1924950
Bosnia and Herzegovina,10/26/22,399811,16169,,,27,,12186.331749885318,,,,,70,BIH,2022/10/26,2,0,
Bosnia and Herzegovina,10/26/22,399811,16169,,,27,,12186.331749885318,,,,,70,BIH,2022/10/26,2,1924950,1924950
Bosnia and Herzegovina,10/27/22,399861,16169,,,50,,12187.855761449518,,,,,70,BIH,2022/10/27,0,0,
Bosnia and Herzegovina,10/27/22,399861,16169,,,50,,12187.855761449518,,,,,70,BIH,2022/10/27,0,1924950,1924950
Bosnia and Herzegovina,10/28/22,399891,16169,,,30,,12188.770168388037,,,,,70,BIH,2022/10/28,0,0,
Bosnia and Herzegovina,10/28/22,399891,16169,,,30,,12188.770168388037,,,,,70,BIH,2022/10/28,0,1924950,1924950
Bosnia and Herzegovina,10/31/22,399963,16174,,,72,,12190.964745040485,,,,,70,BIH,2022/10/31,5,0,
Bosnia and Herzegovina,10/31/22,399963,16174,,,72,,12190.964745040485,,,,,70,BIH,2022/10/31,5,1924950,1924950
Bosnia and Herzegovina,11/1/22,399981,16175,,,18,,12191.513389203597,,,,,70,BIH,2022/11/01,1,0,
Bosnia and Herzegovina,11/1/22,399981,16175,,,18,,12191.513389203597,,,,,70,BIH,2022/11/01,1,1924950,1924950
Bosnia and Herzegovina,11/2/22,399993,16177,,,12,,12191.879151979005,,,,,70,BIH,2022/11/02,2,0,
Bosnia and Herzegovina,11/2/22,399993,16177,,,12,,12191.879151979005,,,,,70,BIH,2022/11/02,2,1924950,1924950
Bosnia and Herzegovina,11/3/22,400027,16180,,,34,,12192.91547984266,,,,,70,BIH,2022/11/03,3,0,
Bosnia and Herzegovina,11/3/22,400027,16180,,,34,,12192.91547984266,,,,,70,BIH,2022/11/03,3,1924950,1924950
Bosnia and Herzegovina,11/4/22,400043,16180,,,16,,12193.403163543206,,,,,70,BIH,2022/11/04,0,0,
Bosnia and Herzegovina,11/4/22,400043,16180,,,16,,12193.403163543206,,,,,70,BIH,2022/11/04,0,1924950,1924950
Bosnia and Herzegovina,11/7/22,400090,16182,,,47,,12194.835734413553,,,,,70,BIH,2022/11/07,2,0,
Bosnia and Herzegovina,11/7/22,400090,16182,,,47,,12194.835734413553,,,,,70,BIH,2022/11/07,2,1924950,1924950
Bosnia and Herzegovina,11/8/22,400119,16182,,,29,,12195.71966112079,,,,,70,BIH,2022/11/08,0,0,
Bosnia and Herzegovina,11/8/22,400119,16182,,,29,,12195.71966112079,,,,,70,BIH,2022/11/08,0,1924950,1924950
Bosnia and Herzegovina,11/9/22,400129,16183,,,10,,12196.024463433629,,,,,70,BIH,2022/11/09,1,0,
Bosnia and Herzegovina,11/9/22,400129,16183,,,10,,12196.024463433629,,,,,70,BIH,2022/11/09,1,1924950,1924950
Bosnia and Herzegovina,11/10/22,400162,16184,,,33,,12197.030311066,,,,,70,BIH,2022/11/10,1,,
Bosnia and Herzegovina,11/11/22,400185,16184,,,23,,12197.731356385531,,,,,70,BIH,2022/11/11,0,,
Bosnia and Herzegovina,11/14/22,400261,16187,,,76,,12200.047853963117,,,,,70,BIH,2022/11/14,3,,
Botswana,10/18/22,326344,2790,,,0,,13877.382660925956,,,,,72,BWA,2022/10/18,0,0,
Botswana,10/18/22,326344,2790,,,0,,13877.382660925956,,,,,72,BWA,2022/10/18,0,2871301,2871301
Botswana,11/14/22,326344,2790,,,0,,13877.382660925956,,,,,72,BWA,2022/11/14,0,,
Brazil,10/18/22,34746462,687144,,,0,,16346.706157806451,,,,,76,BRA,2022/10/18,0,0,
Brazil,10/18/22,34746462,687144,,,0,,16346.706157806451,,,,,76,BRA,2022/10/18,0,484474086,484474086
Brazil,10/19/22,34771320,687423,,,24858,,16358.400770675835,,,,,76,BRA,2022/10/19,279,0,
Brazil,10/19/22,34771320,687423,,,24858,,16358.400770675835,,,,,76,BRA,2022/10/19,279,484474086,484474086
Brazil,10/21/22,34780462,687527,,,9142,,16362.701685908432,,,,,76,BRA,2022/10/21,104,0,
Brazil,10/21/22,34780462,687527,,,9142,,16362.701685908432,,,,,76,BRA,2022/10/21,104,485255043,485255043
Brazil,10/24/22,34783786,687574,,,3324,,16364.265484008756,,,,,76,BRA,2022/10/24,47,0,
Brazil,10/24/22,34783786,687574,,,3324,,16364.265484008756,,,,,76,BRA,2022/10/24,47,485255043,485255043
Brazil,10/25/22,34799324,687710,,,15538,,16371.57544035136,,,,,76,BRA,2022/10/25,136,0,
Brazil,10/25/22,34799324,687710,,,15538,,16371.57544035136,,,,,76,BRA,2022/10/25,136,485255043,485255043
Brazil,10/26/22,34807075,687907,,,7751,,16375.221950301904,,,,,76,BRA,2022/10/26,197,0,
Brazil,10/26/22,34807075,687907,,,7751,,16375.221950301904,,,,,76,BRA,2022/10/26,197,486682379,486682379
Brazil,10/27/22,34815258,687962,,,8183,,16379.071697550684,,,,,76,BRA,2022/10/27,55,0,
Brazil,10/27/22,34815258,687962,,,8183,,16379.071697550684,,,,,76,BRA,2022/10/27,55,486682379,486682379
Brazil,10/31/22,34828749,688157,,,13491,,16385.418629010208,,,,,76,BRA,2022/10/31,195,0,
Brazil,10/31/22,34828749,688157,,,13491,,16385.418629010208,,,,,76,BRA,2022/10/31,195,486682379,486682379
Brazil,11/1/22,34837035,688219,,,8286,,16389.316833300003,,,,,76,BRA,2022/11/01,62,0,
Brazil,11/1/22,34837035,688219,,,8286,,16389.316833300003,,,,,76,BRA,2022/11/01,62,486682379,486682379
Brazil,11/3/22,34846308,688267,,,9273,,16393.679378361463,,,,,76,BRA,2022/11/03,48,0,
Brazil,11/3/22,34846308,688267,,,9273,,16393.679378361463,,,,,76,BRA,2022/11/03,48,487760773,487760773
Brazil,11/4/22,34849063,688332,,,2755,,16394.975486594434,,,,,76,BRA,2022/11/04,65,0,
Brazil,11/4/22,34849063,688332,,,2755,,16394.975486594434,,,,,76,BRA,2022/11/04,65,487760773,487760773
Brazil,11/7/22,34855492,688395,,,6429,,16398.000052775835,,,,,76,BRA,2022/11/07,63,0,
Brazil,11/7/22,34855492,688395,,,6429,,16398.000052775835,,,,,76,BRA,2022/11/07,63,487760773,487760773
Brazil,11/10/22,34889576,688607,,,34084,,16414.035099241362,,,,,76,BRA,2022/11/10,212,,
Brazil,11/11/22,34908198,688656,,,18622,,16422.795944074158,,,,,76,BRA,2022/11/11,49,,
Brazil,11/14/22,34908198,688656,,,0,,16422.795944074158,,,,,76,BRA,2022/11/14,0,,
Brunei,10/18/22,234582,225,,,2749,,53620.82640925476,,,,,96,BRN,2022/10/18,0,0,
Brunei,10/18/22,234582,225,,,2749,,53620.82640925476,,,,,96,BRN,2022/10/18,0,1273212,1273212
Brunei,10/25/22,237656,225,,,3074,,54323.48228388303,,,,,96,BRN,2022/10/25,0,0,
Brunei,10/25/22,237656,225,,,3074,,54323.48228388303,,,,,96,BRN,2022/10/25,0,1278500,1278500
Brunei,11/2/22,241044,225,,,3388,,55097.912376023756,,,,,96,BRN,2022/11/02,0,0,
Brunei,11/2/22,241044,225,,,3388,,55097.912376023756,,,,,96,BRN,2022/11/02,0,1278500,1278500
Brunei,11/9/22,244599,225,,,3555,,55910.5153800262,,,,,96,BRN,2022/11/09,0,0,
Brunei,11/9/22,244599,225,,,3555,,55910.5153800262,,,,,96,BRN,2022/11/09,0,1278500,1278500
Brunei,11/14/22,244599,225,,,0,,55910.5153800262,,,,,96,BRN,2022/11/14,0,,
Bulgaria,10/18/22,1272015,37801,,,787,,18306.470008757355,,,,,100,BGR,2022/10/18,6,0,
Bulgaria,10/18/22,1272015,37801,,,787,,18306.470008757355,,,,,100,BGR,2022/10/18,6,4568319,4568319
Bulgaria,10/19/22,1272645,37812,,,630,,18315.53678556857,,,,,100,BGR,2022/10/19,11,0,
Bulgaria,10/19/22,1272645,37812,,,630,,18315.53678556857,,,,,100,BGR,2022/10/19,11,4569732,4569732
Bulgaria,10/20/22,1273231,37816,,,586,,18323.97032717392,,,,,100,BGR,2022/10/20,4,0,
Bulgaria,10/20/22,1273231,37816,,,586,,18323.97032717392,,,,,100,BGR,2022/10/20,4,4571262,4571262
Bulgaria,10/21/22,1273949,37820,,,718,,18334.30357439686,,,,,100,BGR,2022/10/21,4,0,
Bulgaria,10/21/22,1273949,37820,,,718,,18334.30357439686,,,,,100,BGR,2022/10/21,4,4572337,4572337
Bulgaria,10/22/22,1274169,37821,,,220,,18337.469750426175,,,,,100,BGR,2022/10/22,1,0,
Bulgaria,10/22/22,1274169,37821,,,220,,18337.469750426175,,,,,100,BGR,2022/10/22,1,4572472,4572472
Bulgaria,10/23/22,1274336,37821,,,167,,18339.873165866607,,,,,100,BGR,2022/10/23,0,0,
Bulgaria,10/23/22,1274336,37821,,,167,,18339.873165866607,,,,,100,BGR,2022/10/23,0,4572487,4572487
Bulgaria,10/24/22,1275481,37840,,,1145,,18356.35167292826,,,,,100,BGR,2022/10/24,19,0,
Bulgaria,10/24/22,1275481,37840,,,1145,,18356.35167292826,,,,,100,BGR,2022/10/24,19,4573152,4573152
Bulgaria,10/25/22,1276146,37847,,,665,,18365.92215956232,,,,,100,BGR,2022/10/25,7,0,
Bulgaria,10/25/22,1276146,37847,,,665,,18365.92215956232,,,,,100,BGR,2022/10/25,7,4574309,4574309
Bulgaria,10/26/22,1276765,37853,,,619,,18374.830627572068,,,,,100,BGR,2022/10/26,6,0,
Bulgaria,10/26/22,1276765,37853,,,619,,18374.830627572068,,,,,100,BGR,2022/10/26,6,4575563,4575563
Bulgaria,10/27/22,1277342,37857,,,577,,18383.1346437944,,,,,100,BGR,2022/10/27,4,0,
Bulgaria,10/27/22,1277342,37857,,,577,,18383.1346437944,,,,,100,BGR,2022/10/27,4,4577148,4577148
Bulgaria,10/28/22,1277935,37860,,,593,,18391.668927364324,,,,,100,BGR,2022/10/28,3,0,
Bulgaria,10/28/22,1277935,37860,,,593,,18391.668927364324,,,,,100,BGR,2022/10/28,3,4578300,4578300
Bulgaria,10/29/22,1278115,37860,,,180,,18394.259435024673,,,,,100,BGR,2022/10/29,0,0,
Bulgaria,10/29/22,1278115,37860,,,180,,18394.259435024673,,,,,100,BGR,2022/10/29,0,4578398,4578398
Bulgaria,10/30/22,1278236,37860,,,121,,18396.000831840793,,,,,100,BGR,2022/10/30,0,0,
Bulgaria,10/30/22,1278236,37860,,,121,,18396.000831840793,,,,,100,BGR,2022/10/30,0,4578398,4578398
Bulgaria,10/31/22,1279082,37880,,,846,,18408.176217844426,,,,,100,BGR,2022/10/31,20,0,
Bulgaria,10/31/22,1279082,37880,,,846,,18408.176217844426,,,,,100,BGR,2022/10/31,20,4578980,4578980
Bulgaria,11/1/22,1279595,37888,,,513,,18415.55916467641,,,,,100,BGR,2022/11/01,8,0,
Bulgaria,11/1/22,1279595,37888,,,513,,18415.55916467641,,,,,100,BGR,2022/11/01,8,4579803,4579803
Bulgaria,11/2/22,1280004,37898,,,409,,18421.44537374909,,,,,100,BGR,2022/11/02,10,0,
Bulgaria,11/2/22,1280004,37898,,,409,,18421.44537374909,,,,,100,BGR,2022/11/02,10,4580721,4580721
Bulgaria,11/3/22,1280584,37903,,,580,,18429.7925650991,,,,,100,BGR,2022/11/03,5,0,
Bulgaria,11/3/22,1280584,37903,,,580,,18429.7925650991,,,,,100,BGR,2022/11/03,5,4582059,4582059
Bulgaria,11/5/22,1281155,37916,,,571,,18438.010231066088,,,,,100,BGR,2022/11/05,13,0,
Bulgaria,11/5/22,1281155,37916,,,571,,18438.010231066088,,,,,100,BGR,2022/11/05,13,4583168,4583168
Bulgaria,11/6/22,1281252,37920,,,97,,18439.40622686083,,,,,100,BGR,2022/11/06,4,0,
Bulgaria,11/6/22,1281252,37920,,,97,,18439.40622686083,,,,,100,BGR,2022/11/06,4,4583170,4583170
Bulgaria,11/7/22,1281924,37931,,,672,,18449.077455459457,,,,,100,BGR,2022/11/07,11,0,
Bulgaria,11/7/22,1281924,37931,,,672,,18449.077455459457,,,,,100,BGR,2022/11/07,11,4583739,4583739
Bulgaria,11/9/22,1282284,37936,,,360,,18454.258470780154,,,,,100,BGR,2022/11/09,5,0,
Bulgaria,11/9/22,1282284,37936,,,360,,18454.258470780154,,,,,100,BGR,2022/11/09,5,4585631,4585631
Bulgaria,11/10/22,1282751,37940,,,467,,18460.97939898783,,,,,100,BGR,2022/11/10,4,,
Bulgaria,11/11/22,1283364,37952,,,613,,18469.801516742235,,,,,100,BGR,2022/11/11,12,,
Bulgaria,11/12/22,1283495,37953,,,131,,18471.6868306506,,,,,100,BGR,2022/11/12,1,,
Bulgaria,11/13/22,1283572,37954,,,77,,18472.794992260857,,,,,100,BGR,2022/11/13,1,,
Bulgaria,11/14/22,1284051,37965,,,479,,18479.688620979225,,,,,100,BGR,2022/11/14,11,,
Burkina Faso,10/18/22,21631,387,,,0,,103.48137741841256,,,,,854,BFA,2022/10/18,0,0,
Burkina Faso,10/18/22,21631,387,,,0,,103.48137741841256,,,,,854,BFA,2022/10/18,0,4070678,4070678
Burkina Faso,11/14/22,21631,387,,,0,,103.48137741841256,,,,,854,BFA,2022/11/14,0,,
Burma,10/18/22,629376,19471,,,515,,1156.7329220176794,,,,,104,MMR,2022/10/18,0,0,
Burma,10/18/22,629376,19471,,,515,,1156.7329220176794,,,,,104,MMR,2022/10/18,0,64549994,64549994
Burma,10/19/22,629653,19472,,,277,,1157.2420215375196,,,,,104,MMR,2022/10/19,1,0,
Burma,10/19/22,629653,19472,,,277,,1157.2420215375196,,,,,104,MMR,2022/10/19,1,64549994,64549994
Burma,10/20/22,629926,19472,,,273,,1157.7437694397447,,,,,104,MMR,2022/10/20,0,0,
Burma,10/20/22,629926,19472,,,273,,1157.7437694397447,,,,,104,MMR,2022/10/20,0,64549994,64549994
Burma,10/21/22,630183,19473,,,257,,1158.2161108715097,,,,,104,MMR,2022/10/21,1,0,
Burma,10/21/22,630183,19473,,,257,,1158.2161108715097,,,,,104,MMR,2022/10/21,1,64549994,64549994
Burma,10/22/22,630445,19475,,,262,,1158.6976418252934,,,,,104,MMR,2022/10/22,2,0,
Burma,10/22/22,630445,19475,,,262,,1158.6976418252934,,,,,104,MMR,2022/10/22,2,64549994,64549994
Burma,10/23/22,630603,19476,,,158,,1158.9880307210867,,,,,104,MMR,2022/10/23,1,0,
Burma,10/23/22,630603,19476,,,158,,1158.9880307210867,,,,,104,MMR,2022/10/23,1,64549994,64549994
Burma,10/24/22,630742,19477,,,139,,1159.2434994332086,,,,,104,MMR,2022/10/24,1,0,
Burma,10/24/22,630742,19477,,,139,,1159.2434994332086,,,,,104,MMR,2022/10/24,1,64549994,64549994
Burma,10/25/22,630902,19478,,,160,,1159.5375641378093,,,,,104,MMR,2022/10/25,1,0,
Burma,10/25/22,630902,19478,,,160,,1159.5375641378093,,,,,104,MMR,2022/10/25,1,64549994,64549994
Burma,10/26/22,631059,19480,,,157,,1159.826115129199,,,,,104,MMR,2022/10/26,2,0,
Burma,10/26/22,631059,19480,,,157,,1159.826115129199,,,,,104,MMR,2022/10/26,2,64549994,64549994
Burma,10/27/22,631235,19480,,,176,,1160.1495863042599,,,,,104,MMR,2022/10/27,0,0,
Burma,10/27/22,631235,19480,,,176,,1160.1495863042599,,,,,104,MMR,2022/10/27,0,64549994,64549994
Burma,10/28/22,631367,19481,,,132,,1160.3921896855554,,,,,104,MMR,2022/10/28,1,0,
Burma,10/28/22,631367,19481,,,132,,1160.3921896855554,,,,,104,MMR,2022/10/28,1,64549994,64549994
Burma,10/29/22,631534,19481,,,167,,1160.6991197209825,,,,,104,MMR,2022/10/29,0,0,
Burma,10/29/22,631534,19481,,,167,,1160.6991197209825,,,,,104,MMR,2022/10/29,0,64549994,64549994
Burma,10/30/22,631625,19482,,,91,,1160.8663690217243,,,,,104,MMR,2022/10/30,1,0,
Burma,10/30/22,631625,19482,,,91,,1160.8663690217243,,,,,104,MMR,2022/10/30,1,64549994,64549994
Burma,10/31/22,631716,19482,,,91,,1161.033618322466,,,,,104,MMR,2022/10/31,0,0,
Burma,10/31/22,631716,19482,,,91,,1161.033618322466,,,,,104,MMR,2022/10/31,0,64549994,64549994
Burma,11/1/22,631797,19483,,,81,,1161.1824885791702,,,,,104,MMR,2022/11/01,1,0,
Burma,11/1/22,631797,19483,,,81,,1161.1824885791702,,,,,104,MMR,2022/11/01,1,64549994,64549994
Burma,11/2/22,631929,19483,,,132,,1161.4250919604658,,,,,104,MMR,2022/11/02,0,0,
Burma,11/2/22,631929,19483,,,132,,1161.4250919604658,,,,,104,MMR,2022/11/02,0,64549994,64549994
Burma,11/3/22,632014,19484,,,85,,1161.581313834785,,,,,104,MMR,2022/11/03,1,0,
Burma,11/3/22,632014,19484,,,85,,1161.581313834785,,,,,104,MMR,2022/11/03,1,64549994,64549994
Burma,11/4/22,632139,19484,,,125,,1161.8110518852543,,,,,104,MMR,2022/11/04,0,0,
Burma,11/4/22,632139,19484,,,125,,1161.8110518852543,,,,,104,MMR,2022/11/04,0,64549994,64549994
Burma,11/5/22,632229,19485,,,90,,1161.9764632815923,,,,,104,MMR,2022/11/05,1,0,
Burma,11/5/22,632229,19485,,,90,,1161.9764632815923,,,,,104,MMR,2022/11/05,1,64549994,64549994
Burma,11/6/22,632274,19485,,,45,,1162.0591689797614,,,,,104,MMR,2022/11/06,0,0,
Burma,11/6/22,632274,19485,,,45,,1162.0591689797614,,,,,104,MMR,2022/11/06,0,64549994,64549994
Burma,11/7/22,632318,19485,,,44,,1162.1400367735264,,,,,104,MMR,2022/11/07,0,0,
Burma,11/7/22,632318,19485,,,44,,1162.1400367735264,,,,,104,MMR,2022/11/07,0,64549994,64549994
Burma,11/8/22,632391,19486,,,73,,1162.2742037950006,,,,,104,MMR,2022/11/08,1,0,
Burma,11/8/22,632391,19486,,,73,,1162.2742037950006,,,,,104,MMR,2022/11/08,1,64549994,64549994
Burma,11/9/22,632461,19486,,,70,,1162.4028571032634,,,,,104,MMR,2022/11/09,0,0,
Burma,11/9/22,632461,19486,,,70,,1162.4028571032634,,,,,104,MMR,2022/11/09,0,64549994,64549994
Burma,11/10/22,632522,19486,,,61,,1162.5149692718926,,,,,104,MMR,2022/11/10,0,,
Burma,11/11/22,632587,19486,,,65,,1162.6344330581367,,,,,104,MMR,2022/11/11,0,,
Burma,11/12/22,632635,19486,,,48,,1162.7226524695168,,,,,104,MMR,2022/11/12,0,,
Burma,11/13/22,632679,19486,,,44,,1162.803520263282,,,,,104,MMR,2022/11/13,0,,
Burma,11/14/22,632711,19486,,,32,,1162.862333204202,,,,,104,MMR,2022/11/14,0,,
Burundi,10/18/22,50372,38,,,0,,423.62230033502425,,,,,108,BDI,2022/10/18,0,0,
Burundi,10/18/22,50372,38,,,0,,423.62230033502425,,,,,108,BDI,2022/10/18,0,24236,24236
Burundi,10/21/22,50413,38,,,41,,423.9671052725637,,,,,108,BDI,2022/10/21,0,0,
Burundi,10/21/22,50413,38,,,41,,423.9671052725637,,,,,108,BDI,2022/10/21,0,24236,24236
Burundi,10/24/22,50452,38,,,39,,424.2950904570524,,,,,108,BDI,2022/10/24,0,0,
Burundi,10/24/22,50452,38,,,39,,424.2950904570524,,,,,108,BDI,2022/10/24,0,24236,24236
Burundi,10/26/22,50470,38,,,18,,424.44646823450876,,,,,108,BDI,2022/10/26,0,0,
Burundi,10/26/22,50470,38,,,18,,424.44646823450876,,,,,108,BDI,2022/10/26,0,25258,25258
Burundi,11/7/22,50517,38,,,47,,424.8417324312003,,,,,108,BDI,2022/11/07,0,0,
Burundi,11/7/22,50517,38,,,47,,424.8417324312003,,,,,108,BDI,2022/11/07,0,25983,25983
Burundi,11/8/22,50574,38,,,57,,425.32109539314536,,,,,108,BDI,2022/11/08,0,0,
Burundi,11/8/22,50574,38,,,57,,425.32109539314536,,,,,108,BDI,2022/11/08,0,25983,25983
Burundi,11/14/22,50574,38,,,0,,425.32109539314536,,,,,108,BDI,2022/11/14,0,,
Cabo Verde,10/18/22,62397,410,,,0,,11222.724231458233,,,,,132,CPV,2022/10/18,0,0,
Cabo Verde,10/18/22,62397,410,,,0,,11222.724231458233,,,,,132,CPV,2022/10/18,0,859940,859940
Cabo Verde,11/3/22,62516,410,,,119,,11244.127571098657,,,,,132,CPV,2022/11/03,0,0,
Cabo Verde,11/3/22,62516,410,,,119,,11244.127571098657,,,,,132,CPV,2022/11/03,0,859940,859940
Cabo Verde,11/4/22,62529,410,,,13,,11246.465751059375,,,,,132,CPV,2022/11/04,0,0,
Cabo Verde,11/4/22,62529,410,,,13,,11246.465751059375,,,,,132,CPV,2022/11/04,0,859940,859940
Cabo Verde,11/5/22,62553,410,,,24,,11250.782390986857,,,,,132,CPV,2022/11/05,0,0,
Cabo Verde,11/5/22,62553,410,,,24,,11250.782390986857,,,,,132,CPV,2022/11/05,0,859940,859940
Cabo Verde,11/6/22,62561,410,,,8,,11252.221270962682,,,,,132,CPV,2022/11/06,0,0,
Cabo Verde,11/6/22,62561,410,,,8,,11252.221270962682,,,,,132,CPV,2022/11/06,0,859940,859940
Cabo Verde,11/8/22,62566,410,,,5,,11253.120570947574,,,,,132,CPV,2022/11/08,0,0,
Cabo Verde,11/8/22,62566,410,,,5,,11253.120570947574,,,,,132,CPV,2022/11/08,0,859940,859940
Cabo Verde,11/9/22,62619,410,,,53,,11262.653150787428,,,,,132,CPV,2022/11/09,0,0,
Cabo Verde,11/9/22,62619,410,,,53,,11262.653150787428,,,,,132,CPV,2022/11/09,0,859940,859940
Cabo Verde,11/10/22,62646,410,,,27,,11267.509370705842,,,,,132,CPV,2022/11/10,0,,
Cabo Verde,11/12/22,62672,410,,,26,,11272.18573062728,,,,,132,CPV,2022/11/12,0,,
Cabo Verde,11/13/22,62693,410,,,21,,11275.962790563824,,,,,132,CPV,2022/11/13,0,,
Cabo Verde,11/14/22,62693,410,,,0,,11275.962790563824,,,,,132,CPV,2022/11/14,0,,
Cambodia,10/18/22,137975,3056,,,5,,825.2601191783872,,,,,116,KHM,2022/10/18,0,0,
Cambodia,10/18/22,137975,3056,,,5,,825.2601191783872,,,,,116,KHM,2022/10/18,0,44056099,44056099
Cambodia,10/19/22,137976,3056,,,1,,825.2661004077344,,,,,116,KHM,2022/10/19,0,0,
Cambodia,10/19/22,137976,3056,,,1,,825.2661004077344,,,,,116,KHM,2022/10/19,0,44056099,44056099
Cambodia,10/20/22,137979,3056,,,3,,825.284044095776,,,,,116,KHM,2022/10/20,0,0,
Cambodia,10/20/22,137979,3056,,,3,,825.284044095776,,,,,116,KHM,2022/10/20,0,44203568,44203568
Cambodia,10/28/22,137981,3056,,,2,,825.2960065544704,,,,,116,KHM,2022/10/28,0,0,
Cambodia,10/28/22,137981,3056,,,2,,825.2960065544704,,,,,116,KHM,2022/10/28,0,44361693,44361693
Cambodia,10/29/22,137985,3056,,,4,,825.3199314718591,,,,,116,KHM,2022/10/29,0,0,
Cambodia,10/29/22,137985,3056,,,4,,825.3199314718591,,,,,116,KHM,2022/10/29,0,44361693,44361693
Cambodia,10/30/22,137988,3056,,,3,,825.3378751599007,,,,,116,KHM,2022/10/30,0,0,
Cambodia,10/30/22,137988,3056,,,3,,825.3378751599007,,,,,116,KHM,2022/10/30,0,44361693,44361693
Cambodia,10/31/22,137991,3056,,,3,,825.3558188479423,,,,,116,KHM,2022/10/31,0,0,
Cambodia,10/31/22,137991,3056,,,3,,825.3558188479423,,,,,116,KHM,2022/10/31,0,44361693,44361693
Cambodia,11/1/22,137992,3056,,,1,,825.3618000772894,,,,,116,KHM,2022/11/01,0,0,
Cambodia,11/1/22,137992,3056,,,1,,825.3618000772894,,,,,116,KHM,2022/11/01,0,44361693,44361693
Cambodia,11/2/22,137993,3056,,,1,,825.3677813066366,,,,,116,KHM,2022/11/02,0,0,
Cambodia,11/2/22,137993,3056,,,1,,825.3677813066366,,,,,116,KHM,2022/11/02,0,44361693,44361693
Cambodia,11/3/22,137995,3056,,,2,,825.379743765331,,,,,116,KHM,2022/11/03,0,0,
Cambodia,11/3/22,137995,3056,,,2,,825.379743765331,,,,,116,KHM,2022/11/03,0,44361693,44361693
Cambodia,11/7/22,137996,3056,,,1,,825.3857249946782,,,,,116,KHM,2022/11/07,0,0,
Cambodia,11/7/22,137996,3056,,,1,,825.3857249946782,,,,,116,KHM,2022/11/07,0,44361693,44361693
Cambodia,11/14/22,137999,3056,,,3,,825.4036686827197,,,,,116,KHM,2022/11/14,0,,
Cameroon,10/18/22,121652,1935,,,0,,458.27101351833943,,,,,120,CMR,2022/10/18,0,0,
Cameroon,10/18/22,121652,1935,,,0,,458.27101351833943,,,,,120,CMR,2022/10/18,0,1901047,1901047
Cameroon,10/24/22,123629,1960,,,1977,,465.71850138311567,,,,,120,CMR,2022/10/24,25,0,
Cameroon,10/24/22,123629,1960,,,1977,,465.71850138311567,,,,,120,CMR,2022/10/24,25,1901047,1901047
Cameroon,11/7/22,123993,1965,,,364,,467.0897131093567,,,,,120,CMR,2022/11/07,5,0,
Cameroon,11/7/22,123993,1965,,,364,,467.0897131093567,,,,,120,CMR,2022/11/07,5,1924807,1924807
Cameroon,11/14/22,123993,1965,,,0,,467.0897131093567,,,,,120,CMR,2022/11/14,0,,
Canada,10/18/22,4330359,45978,,,3633,,11439.119528149287,,,,,124,CAN,2022/10/18,37,0,
Canada,10/18/22,4330359,45978,,,3633,,11439.119528149287,,,,,124,CAN,2022/10/18,37,91223081,91223081
Canada,10/19/22,4332828,46020,,,2469,,11445.641663176659,,,,,124,CAN,2022/10/19,42,0,
Canada,10/19/22,4332828,46020,,,2469,,11445.641663176659,,,,,124,CAN,2022/10/19,42,91287504,91287504
Canada,10/20/22,4341692,46170,,,8864,,11469.056893991821,,,,,124,CAN,2022/10/20,150,0,
Canada,10/20/22,4341692,46170,,,8864,,11469.056893991821,,,,,124,CAN,2022/10/20,150,91477011,91477011
Canada,10/21/22,4344504,46218,,,2812,,11476.485101240494,,,,,124,CAN,2022/10/21,48,0,
Canada,10/21/22,4344504,46218,,,2812,,11476.485101240494,,,,,124,CAN,2022/10/21,48,91760269,91760269
Canada,10/22/22,4345265,46230,,,761,,11478.495366431192,,,,,124,CAN,2022/10/22,12,0,
Canada,10/22/22,4345265,46230,,,761,,11478.495366431192,,,,,124,CAN,2022/10/22,12,91760269,91760269
Canada,10/23/22,4345847,46232,,,582,,11480.032783436429,,,,,124,CAN,2022/10/23,2,0,
Canada,10/23/22,4345847,46232,,,582,,11480.032783436429,,,,,124,CAN,2022/10/23,2,91760269,91760269
Canada,10/24/22,4347202,46319,,,1355,,11483.61216495206,,,,,124,CAN,2022/10/24,87,0,
Canada,10/24/22,4347202,46319,,,1355,,11483.61216495206,,,,,124,CAN,2022/10/24,87,91844257,91844257
Canada,10/25/22,4351286,46354,,,4084,,11494.400500088468,,,,,124,CAN,2022/10/25,35,0,
Canada,10/25/22,4351286,46354,,,4084,,11494.400500088468,,,,,124,CAN,2022/10/25,35,91861243,91861243
Canada,10/26/22,4353606,46406,,,2320,,11500.52903522962,,,,,124,CAN,2022/10/26,52,0,
Canada,10/26/22,4353606,46406,,,2320,,11500.52903522962,,,,,124,CAN,2022/10/26,52,91945442,91945442
Canada,10/27/22,4362298,46563,,,8692,,11523.489909129145,,,,,124,CAN,2022/10/27,157,0,
Canada,10/27/22,4362298,46563,,,8692,,11523.489909129145,,,,,124,CAN,2022/10/27,157,92492874,92492874
Canada,10/28/22,4366909,46657,,,4611,,11535.670372722187,,,,,124,CAN,2022/10/28,94,0,
Canada,10/28/22,4366909,46657,,,4611,,11535.670372722187,,,,,124,CAN,2022/10/28,94,92518029,92518029
Canada,10/29/22,4367727,46669,,,818,,11537.831209681437,,,,,124,CAN,2022/10/29,12,0,
Canada,10/29/22,4367727,46669,,,818,,11537.831209681437,,,,,124,CAN,2022/10/29,12,92518029,92518029
Canada,10/30/22,4368284,46672,,,557,,11539.302586437308,,,,,124,CAN,2022/10/30,3,0,
Canada,10/30/22,4368284,46672,,,557,,11539.302586437308,,,,,124,CAN,2022/10/30,3,92518029,92518029
Canada,10/31/22,4368845,46674,,,561,,11540.784529633078,,,,,124,CAN,2022/10/31,2,0,
Canada,10/31/22,4368845,46674,,,561,,11540.784529633078,,,,,124,CAN,2022/10/31,2,92568885,92568885
Canada,11/1/22,4372182,46705,,,3337,,11549.599582118435,,,,,124,CAN,2022/11/01,31,0,
Canada,11/1/22,4372182,46705,,,3337,,11549.599582118435,,,,,124,CAN,2022/11/01,31,92583206,92583206
Canada,11/2/22,4374755,46747,,,2573,,11556.39644458317,,,,,124,CAN,2022/11/02,42,0,
Canada,11/2/22,4374755,46747,,,2573,,11556.39644458317,,,,,124,CAN,2022/11/02,42,92699408,92699408
Canada,11/3/22,4383367,46905,,,8612,,11579.145989684725,,,,,124,CAN,2022/11/03,158,0,
Canada,11/3/22,4383367,46905,,,8612,,11579.145989684725,,,,,124,CAN,2022/11/03,158,93165671,93165671
Canada,11/4/22,4384773,46931,,,1406,,11582.86009330906,,,,,124,CAN,2022/11/04,26,0,
Canada,11/4/22,4384773,46931,,,1406,,11582.86009330906,,,,,124,CAN,2022/11/04,26,93188108,93188108
Canada,11/7/22,4388506,46972,,,3733,,11592.721223344372,,,,,124,CAN,2022/11/07,41,0,
Canada,11/7/22,4388506,46972,,,3733,,11592.721223344372,,,,,124,CAN,2022/11/07,41,93233715,93233715
Canada,11/8/22,4391389,47030,,,2883,,11600.336984901243,,,,,124,CAN,2022/11/08,58,0,
Canada,11/8/22,4391389,47030,,,2883,,11600.336984901243,,,,,124,CAN,2022/11/08,58,93233715,93233715
Canada,11/9/22,4393414,47087,,,2025,,11605.68624509988,,,,,124,CAN,2022/11/09,57,0,
Canada,11/9/22,4393414,47087,,,2025,,11605.68624509988,,,,,124,CAN,2022/11/09,57,93233715,93233715
Canada,11/10/22,4401096,47240,,,7682,,11625.979092925023,,,,,124,CAN,2022/11/10,153,,
Canada,11/11/22,4402177,47272,,,1081,,11628.834673307603,,,,,124,CAN,2022/11/11,32,,
Canada,11/12/22,4402857,47281,,,680,,11630.630968090356,,,,,124,CAN,2022/11/12,9,,
Canada,11/13/22,4403371,47282,,,514,,11631.988755617318,,,,,124,CAN,2022/11/13,1,,
Canada,11/14/22,4403891,47284,,,520,,11633.362392804127,,,,,124,CAN,2022/11/14,2,,
Central African Republic,10/18/22,15151,113,,,0,,313.70062802240443,,,,,140,CAF,2022/10/18,0,0,
Central African Republic,10/18/22,15151,113,,,0,,313.70062802240443,,,,,140,CAF,2022/10/18,0,1714941,1714941
Central African Republic,10/24/22,15228,113,,,77,,315.2949088195614,,,,,140,CAF,2022/10/24,0,0,
Central African Republic,10/24/22,15228,113,,,77,,315.2949088195614,,,,,140,CAF,2022/10/24,0,1714941,1714941
Central African Republic,10/25/22,15229,113,,,1,,315.315613764979,,,,,140,CAF,2022/10/25,0,0,
Central African Republic,10/25/22,15229,113,,,1,,315.315613764979,,,,,140,CAF,2022/10/25,0,1714941,1714941
Central African Republic,10/26/22,15260,113,,,31,,315.9574670729253,,,,,140,CAF,2022/10/26,0,0,
Central African Republic,10/26/22,15260,113,,,31,,315.9574670729253,,,,,140,CAF,2022/10/26,0,1722083,1722083
Central African Republic,11/7/22,15289,113,,,29,,316.55791049003636,,,,,140,CAF,2022/11/07,0,0,
Central African Republic,11/7/22,15289,113,,,29,,316.55791049003636,,,,,140,CAF,2022/11/07,0,1754834,1754834
Central African Republic,11/14/22,15289,113,,,0,,316.55791049003636,,,,,140,CAF,2022/11/14,0,,
Chad,10/18/22,7613,193,,,0,,46.34765219888957,,,,,148,TCD,2022/10/18,0,0,
Chad,10/18/22,7613,193,,,0,,46.34765219888957,,,,,148,TCD,2022/10/18,0,3879297,3879297
Chad,10/24/22,7620,194,,,7,,46.39026793058433,,,,,148,TCD,2022/10/24,1,0,
Chad,10/24/22,7620,194,,,7,,46.39026793058433,,,,,148,TCD,2022/10/24,1,3879297,3879297
Chad,10/31/22,7627,194,,,7,,46.432883662279096,,,,,148,TCD,2022/10/31,0,0,
Chad,10/31/22,7627,194,,,7,,46.432883662279096,,,,,148,TCD,2022/10/31,0,3879297,3879297
Chad,11/7/22,7631,194,,,4,,46.457235508961816,,,,,148,TCD,2022/11/07,0,0,
Chad,11/7/22,7631,194,,,4,,46.457235508961816,,,,,148,TCD,2022/11/07,0,3879297,3879297
Chad,11/14/22,7637,194,,,6,,46.493763278985895,,,,,148,TCD,2022/11/14,0,,
Chile,10/18/22,4684770,61455,,,2703,,24506.794207993855,,,,,152,CHL,2022/10/18,7,0,
Chile,10/18/22,4684770,61455,,,2703,,24506.794207993855,,,,,152,CHL,2022/10/18,7,62450959,62450959
Chile,10/19/22,4690513,61459,,,5743,,24536.836775534313,,,,,152,CHL,2022/10/19,4,0,
Chile,10/19/22,4690513,61459,,,5743,,24536.836775534313,,,,,152,CHL,2022/10/19,4,62461055,62461055
Chile,10/20/22,4696888,61495,,,6375,,24570.185437918157,,,,,152,CHL,2022/10/20,36,0,
Chile,10/20/22,4696888,61495,,,6375,,24570.185437918157,,,,,152,CHL,2022/10/20,36,62461055,62461055
Chile,10/21/22,4702881,61513,,,5993,,24601.53579614033,,,,,152,CHL,2022/10/21,18,0,
Chile,10/21/22,4702881,61513,,,5993,,24601.53579614033,,,,,152,CHL,2022/10/21,18,62466903,62466903
Chile,10/22/22,4708870,61535,,,5989,,24632.865229711602,,,,,152,CHL,2022/10/22,22,0,
Chile,10/22/22,4708870,61535,,,5989,,24632.865229711602,,,,,152,CHL,2022/10/22,22,62466903,62466903
Chile,10/23/22,4715098,61549,,,6228,,24665.444911174596,,,,,152,CHL,2022/10/23,14,0,
Chile,10/23/22,4715098,61549,,,6228,,24665.444911174596,,,,,152,CHL,2022/10/23,14,62466903,62466903
Chile,10/24/22,4718965,61549,,,3867,,24685.67381743943,,,,,152,CHL,2022/10/24,0,0,
Chile,10/24/22,4718965,61549,,,3867,,24685.67381743943,,,,,152,CHL,2022/10/24,0,62472340,62472340
Chile,10/25/22,4722184,61577,,,3219,,24702.51293025725,,,,,152,CHL,2022/10/25,28,0,
Chile,10/25/22,4722184,61577,,,3219,,24702.51293025725,,,,,152,CHL,2022/10/25,28,62483003,62483003
Chile,10/26/22,4728938,61584,,,6754,,24737.84420331458,,,,,152,CHL,2022/10/26,7,0,
Chile,10/26/22,4728938,61584,,,6754,,24737.84420331458,,,,,152,CHL,2022/10/26,7,62487954,62487954
Chile,10/27/22,4737212,61607,,,8274,,24781.126843716764,,,,,152,CHL,2022/10/27,23,0,
Chile,10/27/22,4737212,61607,,,8274,,24781.126843716764,,,,,152,CHL,2022/10/27,23,62493004,62493004
Chile,10/28/22,4744343,61632,,,7131,,24818.430265122126,,,,,152,CHL,2022/10/28,25,0,
Chile,10/28/22,4744343,61632,,,7131,,24818.430265122126,,,,,152,CHL,2022/10/28,25,62497592,62497592
Chile,10/29/22,4750775,61652,,,6432,,24852.077103781405,,,,,152,CHL,2022/10/29,20,0,
Chile,10/29/22,4750775,61652,,,6432,,24852.077103781405,,,,,152,CHL,2022/10/29,20,62497592,62497592
Chile,10/30/22,4756206,61677,,,5431,,24880.487548551075,,,,,152,CHL,2022/10/30,25,0,
Chile,10/30/22,4756206,61677,,,5431,,24880.487548551075,,,,,152,CHL,2022/10/30,25,62497592,62497592
Chile,10/31/22,4760186,61677,,,3980,,24901.307576204046,,,,,152,CHL,2022/10/31,0,0,
Chile,10/31/22,4760186,61677,,,3980,,24901.307576204046,,,,,152,CHL,2022/10/31,0,62497592,62497592
Chile,11/1/22,4762773,61677,,,2587,,24914.84059417848,,,,,152,CHL,2022/11/01,0,0,
Chile,11/1/22,4762773,61677,,,2587,,24914.84059417848,,,,,152,CHL,2022/11/01,0,62497592,62497592
Chile,11/2/22,4765929,61677,,,3156,,24931.350143744505,,,,,152,CHL,2022/11/02,0,0,
Chile,11/2/22,4765929,61677,,,3156,,24931.350143744505,,,,,152,CHL,2022/11/02,0,62499898,62499898
Chile,11/3/22,4769638,61725,,,3709,,24950.752526298493,,,,,152,CHL,2022/11/03,48,0,
Chile,11/3/22,4769638,61725,,,3709,,24950.752526298493,,,,,152,CHL,2022/11/03,48,62505424,62505424
Chile,11/4/22,4777208,61737,,,7570,,24990.352428140955,,,,,152,CHL,2022/11/04,12,0,
Chile,11/4/22,4777208,61737,,,7570,,24990.352428140955,,,,,152,CHL,2022/11/04,12,62505424,62505424
Chile,11/5/22,4786198,61789,,,8990,,25037.380581055586,,,,,152,CHL,2022/11/05,52,0,
Chile,11/5/22,4786198,61789,,,8990,,25037.380581055586,,,,,152,CHL,2022/11/05,52,62505424,62505424
Chile,11/6/22,4793902,61813,,,7704,,25077.68145870345,,,,,152,CHL,2022/11/06,24,0,
Chile,11/6/22,4793902,61813,,,7704,,25077.68145870345,,,,,152,CHL,2022/11/06,24,62505424,62505424
Chile,11/7/22,4799221,61853,,,5319,,25105.506013247712,,,,,152,CHL,2022/11/07,40,0,
Chile,11/7/22,4799221,61853,,,5319,,25105.506013247712,,,,,152,CHL,2022/11/07,40,62514273,62514273
Chile,11/8/22,4803251,61868,,,4030,,25126.587599037026,,,,,152,CHL,2022/11/08,15,0,
Chile,11/8/22,4803251,61868,,,4030,,25126.587599037026,,,,,152,CHL,2022/11/08,15,62517878,62517878
Chile,11/9/22,4810774,61870,,,7523,,25165.941636231328,,,,,152,CHL,2022/11/09,2,0,
Chile,11/9/22,4810774,61870,,,7523,,25165.941636231328,,,,,152,CHL,2022/11/09,2,62521577,62521577
Chile,11/10/22,4818999,61923,,,8225,,25208.967949659895,,,,,152,CHL,2022/11/10,53,,
Chile,11/11/22,4826234,61953,,,7235,,25246.815411988853,,,,,152,CHL,2022/11/11,30,,
Chile,11/12/22,4832838,61983,,,6604,,25281.362010637153,,,,,152,CHL,2022/11/12,30,,
Chile,11/13/22,4838658,62008,,,5820,,25311.807377707577,,,,,152,CHL,2022/11/13,25,,
Chile,11/14/22,4842632,62032,,,3974,,25332.59601838419,,,,,152,CHL,2022/11/14,24,,
China,10/18/22,2864168,15517,,,5875,,203.90234667085193,,,,,156,CHN,2022/10/18,7,0,
China,10/18/22,2864168,15517,,,5875,,203.90234667085193,,,,,156,CHN,2022/10/18,7,3457953632,3457953632
China,10/19/22,2870228,15529,,,6060,,204.3337627822062,,,,,156,CHN,2022/10/19,12,0,
China,10/19/22,2870228,15529,,,6060,,204.3337627822062,,,,,156,CHN,2022/10/19,12,3457953632,3457953632
China,10/20/22,2876602,15538,,,6374,,204.78753279768017,,,,,156,CHN,2022/10/20,9,0,
China,10/20/22,2876602,15538,,,6374,,204.78753279768017,,,,,156,CHN,2022/10/20,9,3457953632,3457953632
China,10/21/22,2882971,15547,,,6369,,205.24094685926687,,,,,156,CHN,2022/10/21,9,0,
China,10/21/22,2882971,15547,,,6369,,205.24094685926687,,,,,156,CHN,2022/10/21,9,3457953632,3457953632
China,10/22/22,2889897,15554,,,6926,,205.7340141838939,,,,,156,CHN,2022/10/22,7,0,
China,10/22/22,2889897,15554,,,6926,,205.7340141838939,,,,,156,CHN,2022/10/22,7,3457953632,3457953632
China,10/23/22,2896422,15558,,,6525,,206.19853400676297,,,,,156,CHN,2022/10/23,4,0,
China,10/23/22,2896422,15558,,,6525,,206.19853400676297,,,,,156,CHN,2022/10/23,4,3457953632,3457953632
China,10/24/22,2902917,15565,,,6495,,206.66091810630851,,,,,156,CHN,2022/10/24,7,0,
China,10/24/22,2902917,15565,,,6495,,206.66091810630851,,,,,156,CHN,2022/10/24,7,3457953632,3457953632
China,10/25/22,2909352,15575,,,6435,,207.119030759207,,,,,156,CHN,2022/10/25,10,0,
China,10/25/22,2909352,15575,,,6435,,207.119030759207,,,,,156,CHN,2022/10/25,10,3457953632,3457953632
China,10/26/22,2916167,15582,,,6815,,207.60419590753693,,,,,156,CHN,2022/10/26,7,0,
China,10/26/22,2916167,15582,,,6815,,207.60419590753693,,,,,156,CHN,2022/10/26,7,3457953632,3457953632
China,10/27/22,2923470,15590,,,7303,,208.12410215526305,,,,,156,CHN,2022/10/27,8,0,
China,10/27/22,2923470,15590,,,7303,,208.12410215526305,,,,,156,CHN,2022/10/27,8,3457953632,3457953632
China,10/28/22,2930381,15597,,,6911,,208.6161016182283,,,,,156,CHN,2022/10/28,7,0,
China,10/28/22,2930381,15597,,,6911,,208.6161016182283,,,,,156,CHN,2022/10/28,7,3457953632,3457953632
China,10/29/22,2937389,15605,,,7008,,209.1150065866063,,,,,156,CHN,2022/10/29,8,0,
China,10/29/22,2937389,15605,,,7008,,209.1150065866063,,,,,156,CHN,2022/10/29,8,3457953632,3457953632
China,10/30/22,2944653,15617,,,7264,,209.63213639401184,,,,,156,CHN,2022/10/30,12,0,
China,10/30/22,2944653,15617,,,7264,,209.63213639401184,,,,,156,CHN,2022/10/30,12,3457953632,3457953632
China,10/31/22,2952291,15629,,,7638,,210.1758915521841,,,,,156,CHN,2022/10/31,12,0,
China,10/31/22,2952291,15629,,,7638,,210.1758915521841,,,,,156,CHN,2022/10/31,12,3457953632,3457953632
China,11/1/22,2959481,15642,,,7190,,210.68775324205825,,,,,156,CHN,2022/11/01,13,0,
China,11/1/22,2959481,15642,,,7190,,210.68775324205825,,,,,156,CHN,2022/11/01,13,3457953632,3457953632
China,11/2/22,2967572,15650,,,8091,,211.26375782241593,,,,,156,CHN,2022/11/02,8,0,
China,11/2/22,2967572,15650,,,8091,,211.26375782241593,,,,,156,CHN,2022/11/02,8,3457953632,3457953632
China,11/3/22,2976228,15660,,,8656,,211.87998519203353,,,,,156,CHN,2022/11/03,10,0,
China,11/3/22,2976228,15660,,,8656,,211.87998519203353,,,,,156,CHN,2022/11/03,10,3457953632,3457953632
China,11/4/22,2984649,15671,,,8421,,212.4794827289501,,,,,156,CHN,2022/11/04,11,0,
China,11/4/22,2984649,15671,,,8421,,212.4794827289501,,,,,156,CHN,2022/11/04,11,3457953632,3457953632
China,11/5/22,2997306,15689,,,12657,,213.38054439914995,,,,,156,CHN,2022/11/05,18,0,
China,11/5/22,2997306,15689,,,12657,,213.38054439914995,,,,,156,CHN,2022/11/05,18,3457953632,3457953632
China,11/6/22,3002843,15702,,,5537,,213.77472773389724,,,,,156,CHN,2022/11/06,13,0,
China,11/6/22,3002843,15702,,,5537,,213.77472773389724,,,,,156,CHN,2022/11/06,13,3457953632,3457953632
China,11/7/22,3013968,15707,,,11125,,214.56672513304187,,,,,156,CHN,2022/11/07,5,0,
China,11/7/22,3013968,15707,,,11125,,214.56672513304187,,,,,156,CHN,2022/11/07,5,3457953632,3457953632
China,11/8/22,3026615,15711,,,12647,,215.4670748954672,,,,,156,CHN,2022/11/08,4,0,
China,11/8/22,3026615,15711,,,12647,,215.4670748954672,,,,,156,CHN,2022/11/08,4,3457953632,3457953632
China,11/9/22,3046538,15724,,,19923,,216.8854087546275,,,,,156,CHN,2022/11/09,13,0,
China,11/9/22,3046538,15724,,,19923,,216.8854087546275,,,,,156,CHN,2022/11/09,13,3457953632,3457953632
China,11/10/22,3053673,15733,,,7135,,217.3933549517418,,,,,156,CHN,2022/11/10,9,,
China,11/11/22,3070130,15743,,,16457,,218.56494157625622,,,,,156,CHN,2022/11/11,10,,
China,11/12/22,3100114,15749,,,29984,,220.69952584735304,,,,,156,CHN,2022/11/12,6,,
China,11/13/22,3108324,15758,,,8210,,221.2840021302274,,,,,156,CHN,2022/11/13,9,,
China,11/14/22,3129859,15768,,,21535,,222.81709552263902,,,,,156,CHN,2022/11/14,10,,
Colombia,10/18/22,6308558,141820,,,0,,12398.192681059509,,,,,170,COL,2022/10/18,0,0,
Colombia,10/18/22,6308558,141820,,,0,,12398.192681059509,,,,,170,COL,2022/10/18,0,88720602,88720602
Colombia,10/20/22,6309168,141827,,,610,,12399.391512477949,,,,,170,COL,2022/10/20,7,0,
Colombia,10/20/22,6309168,141827,,,610,,12399.391512477949,,,,,170,COL,2022/10/20,7,89015414,89015414
Colombia,10/27/22,6309716,141837,,,548,,12400.468495457137,,,,,170,COL,2022/10/27,10,0,
Colombia,10/27/22,6309716,141837,,,548,,12400.468495457137,,,,,170,COL,2022/10/27,10,89120782,89120782
Colombia,11/3/22,6310332,141850,,,616,,12401.679118660019,,,,,170,COL,2022/11/03,13,0,
Colombia,11/3/22,6310332,141850,,,616,,12401.679118660019,,,,,170,COL,2022/11/03,13,89209704,89209704
Colombia,11/10/22,6311359,141862,,,1027,,12403.697479097293,,,,,170,COL,2022/11/10,12,,
Colombia,11/14/22,6311359,141862,,,0,,12403.697479097293,,,,,170,COL,2022/11/14,0,,
Comoros,10/18/22,8481,161,,,0,,975.2815966053163,,,,,174,COM,2022/10/18,0,0,
Comoros,10/18/22,8481,161,,,0,,975.2815966053163,,,,,174,COM,2022/10/18,0,835021,835021
Comoros,10/24/22,8672,161,,,191,,997.2458443298317,,,,,174,COM,2022/10/24,0,0,
Comoros,10/24/22,8672,161,,,191,,997.2458443298317,,,,,174,COM,2022/10/24,0,835021,835021
Comoros,10/27/22,8762,161,,,90,,1007.5954898544725,,,,,174,COM,2022/10/27,0,0,
Comoros,10/27/22,8762,161,,,90,,1007.5954898544725,,,,,174,COM,2022/10/27,0,835021,835021
Comoros,11/7/22,8879,161,,,117,,1021.0500290365055,,,,,174,COM,2022/11/07,0,0,
Comoros,11/7/22,8879,161,,,117,,1021.0500290365055,,,,,174,COM,2022/11/07,0,835021,835021
Comoros,11/14/22,8925,161,,,46,,1026.3398478602107,,,,,174,COM,2022/11/14,0,,
Congo (Brazzaville),10/18/22,24837,386,,,0,,450.10123064276564,,,,,178,COG,2022/10/18,0,0,
Congo (Brazzaville),10/18/22,24837,386,,,0,,450.10123064276564,,,,,178,COG,2022/10/18,0,833210,833210
Congo (Brazzaville),11/14/22,24837,386,,,0,,450.10123064276564,,,,,178,COG,2022/11/14,0,,
Congo (Kinshasa),10/18/22,92972,1444,,,0,,103.80810912700743,,,,,180,COD,2022/10/18,0,0,
Congo (Kinshasa),10/18/22,92972,1444,,,0,,103.80810912700743,,,,,180,COD,2022/10/18,0,6020452,6020452
Congo (Kinshasa),10/20/22,93027,1445,,,55,,103.86951950864906,,,,,180,COD,2022/10/20,1,0,
Congo (Kinshasa),10/20/22,93027,1445,,,55,,103.86951950864906,,,,,180,COD,2022/10/20,1,6020452,6020452
Congo (Kinshasa),10/28/22,93086,1445,,,59,,103.93539609986462,,,,,180,COD,2022/10/28,0,0,
Congo (Kinshasa),10/28/22,93086,1445,,,59,,103.93539609986462,,,,,180,COD,2022/10/28,0,6134888,6134888
Congo (Kinshasa),11/4/22,93219,1445,,,133,,104.08389756819801,,,,,180,COD,2022/11/04,0,0,
Congo (Kinshasa),11/4/22,93219,1445,,,133,,104.08389756819801,,,,,180,COD,2022/11/04,0,6185534,6185534
Congo (Kinshasa),11/10/22,93467,1447,,,248,,104.36080256178208,,,,,180,COD,2022/11/10,2,,
Congo (Kinshasa),11/14/22,93467,1447,,,0,,104.36080256178208,,,,,180,COD,2022/11/14,0,,
Costa Rica,10/18/22,1130568,8982,,,2966,,22193.614041617442,,,,,188,CRI,2022/10/18,8,0,
Costa Rica,10/18/22,1130568,8982,,,2966,,22193.614041617442,,,,,188,CRI,2022/10/18,8,12033083,12033083
Costa Rica,10/25/22,1133096,8990,,,2528,,22243.239943197186,,,,,188,CRI,2022/10/25,8,0,
Costa Rica,10/25/22,1133096,8990,,,2528,,22243.239943197186,,,,,188,CRI,2022/10/25,8,12112439,12112439
Costa Rica,11/1/22,1135713,8999,,,2617,,22294.612959191727,,,,,188,CRI,2022/11/01,9,0,
Costa Rica,11/1/22,1135713,8999,,,2617,,22294.612959191727,,,,,188,CRI,2022/11/01,9,12169521,12169521
Costa Rica,11/4/22,1138416,9009,,,2703,,22347.67419810393,,,,,188,CRI,2022/11/04,10,0,
Costa Rica,11/4/22,1138416,9009,,,2703,,22347.67419810393,,,,,188,CRI,2022/11/04,10,12169521,12169521
Costa Rica,11/11/22,1140864,9019,,,2448,,22395.729659760265,,,,,188,CRI,2022/11/11,10,,
Costa Rica,11/14/22,1140864,9019,,,0,,22395.729659760265,,,,,188,CRI,2022/11/14,0,,
Cote d'Ivoire,10/18/22,87602,827,,,0,,332.099047416861,,,,,384,CIV,2022/10/18,0,0,
Cote d'Ivoire,10/18/22,87602,827,,,0,,332.099047416861,,,,,384,CIV,2022/10/18,0,18547812,18547812
Cote d'Ivoire,10/19/22,87657,827,,,55,,332.3075523323644,,,,,384,CIV,2022/10/19,0,0,
Cote d'Ivoire,10/19/22,87657,827,,,55,,332.3075523323644,,,,,384,CIV,2022/10/19,0,18547812,18547812
Cote d'Ivoire,10/20/22,87676,827,,,19,,332.3795813031747,,,,,384,CIV,2022/10/20,0,0,
Cote d'Ivoire,10/20/22,87676,827,,,19,,332.3795813031747,,,,,384,CIV,2022/10/20,0,18547812,18547812
Cote d'Ivoire,10/21/22,87691,827,,,15,,332.43644628013016,,,,,384,CIV,2022/10/21,0,0,
Cote d'Ivoire,10/21/22,87691,827,,,15,,332.43644628013016,,,,,384,CIV,2022/10/21,0,18547812,18547812
Cote d'Ivoire,10/22/22,87693,827,,,2,,332.44402827705755,,,,,384,CIV,2022/10/22,0,0,
Cote d'Ivoire,10/22/22,87693,827,,,2,,332.44402827705755,,,,,384,CIV,2022/10/22,0,18547812,18547812
Cote d'Ivoire,10/23/22,87700,827,,,7,,332.4705652663034,,,,,384,CIV,2022/10/23,0,0,
Cote d'Ivoire,10/23/22,87700,827,,,7,,332.4705652663034,,,,,384,CIV,2022/10/23,0,18547812,18547812
Cote d'Ivoire,10/25/22,87720,827,,,20,,332.54638523557736,,,,,384,CIV,2022/10/25,0,0,
Cote d'Ivoire,10/25/22,87720,827,,,20,,332.54638523557736,,,,,384,CIV,2022/10/25,0,18547812,18547812
Cote d'Ivoire,10/27/22,87731,827,,,11,,332.5880862186781,,,,,384,CIV,2022/10/27,0,0,
Cote d'Ivoire,10/27/22,87731,827,,,11,,332.5880862186781,,,,,384,CIV,2022/10/27,0,18547812,18547812
Cote d'Ivoire,10/28/22,87753,827,,,22,,332.6714881848794,,,,,384,CIV,2022/10/28,0,0,
Cote d'Ivoire,10/28/22,87753,827,,,22,,332.6714881848794,,,,,384,CIV,2022/10/28,0,18547812,18547812
Cote d'Ivoire,10/30/22,87773,827,,,20,,332.74730815415336,,,,,384,CIV,2022/10/30,0,0,
Cote d'Ivoire,10/30/22,87773,827,,,20,,332.74730815415336,,,,,384,CIV,2022/10/30,0,18547812,18547812
Cote d'Ivoire,10/31/22,87774,827,,,1,,332.7510991526171,,,,,384,CIV,2022/10/31,0,0,
Cote d'Ivoire,10/31/22,87774,827,,,1,,332.7510991526171,,,,,384,CIV,2022/10/31,0,18547812,18547812
Cote d'Ivoire,11/1/22,87781,827,,,7,,332.77763614186296,,,,,384,CIV,2022/11/01,0,0,
Cote d'Ivoire,11/1/22,87781,827,,,7,,332.77763614186296,,,,,384,CIV,2022/11/01,0,18547812,18547812
Cote d'Ivoire,11/3/22,87822,828,,,41,,332.93306707887456,,,,,384,CIV,2022/11/03,1,0,
Cote d'Ivoire,11/3/22,87822,828,,,41,,332.93306707887456,,,,,384,CIV,2022/11/03,1,20588390,20588390
Cote d'Ivoire,11/4/22,87824,829,,,2,,332.94064907580196,,,,,384,CIV,2022/11/04,1,0,
Cote d'Ivoire,11/4/22,87824,829,,,2,,332.94064907580196,,,,,384,CIV,2022/11/04,1,20588390,20588390
Cote d'Ivoire,11/5/22,87830,829,,,6,,332.96339506658416,,,,,384,CIV,2022/11/05,0,0,
Cote d'Ivoire,11/5/22,87830,829,,,6,,332.96339506658416,,,,,384,CIV,2022/11/05,0,20588390,20588390
Cote d'Ivoire,11/8/22,87839,829,,,9,,332.9975140527574,,,,,384,CIV,2022/11/08,0,0,
Cote d'Ivoire,11/8/22,87839,829,,,9,,332.9975140527574,,,,,384,CIV,2022/11/08,0,20588390,20588390
Cote d'Ivoire,11/10/22,87847,829,,,8,,333.027842040467,,,,,384,CIV,2022/11/10,0,,
Cote d'Ivoire,11/11/22,87851,829,,,4,,333.0430060343218,,,,,384,CIV,2022/11/11,0,,
Cote d'Ivoire,11/14/22,87860,829,,,9,,333.0771250204951,,,,,384,CIV,2022/11/14,0,,
Croatia,10/18/22,1242154,17039,,,363,,30257.561747491272,,,,,191,HRV,2022/10/18,7,0,
Croatia,10/18/22,1242154,17039,,,363,,30257.561747491272,,,,,191,HRV,2022/10/18,7,5317304,5317304
Croatia,10/19/22,1242909,17046,,,755,,30275.952751440345,,,,,191,HRV,2022/10/19,7,0,
Croatia,10/19/22,1242909,17046,,,755,,30275.952751440345,,,,,191,HRV,2022/10/19,7,5319280,5319280
Croatia,10/20/22,1243500,17053,,,591,,30290.34888830644,,,,,191,HRV,2022/10/20,7,0,
Croatia,10/20/22,1243500,17053,,,591,,30290.34888830644,,,,,191,HRV,2022/10/20,7,5356347,5356347
Croatia,10/21/22,1243928,17060,,,428,,30300.774517035185,,,,,191,HRV,2022/10/21,7,0,
Croatia,10/21/22,1243928,17060,,,428,,30300.774517035185,,,,,191,HRV,2022/10/21,7,5356347,5356347
Croatia,10/22/22,1244365,17070,,,437,,30311.41937627458,,,,,191,HRV,2022/10/22,10,0,
Croatia,10/22/22,1244365,17070,,,437,,30311.41937627458,,,,,191,HRV,2022/10/22,10,5356347,5356347
Croatia,10/23/22,1244642,17076,,,277,,30318.166804213513,,,,,191,HRV,2022/10/23,6,0,
Croatia,10/23/22,1244642,17076,,,277,,30318.166804213513,,,,,191,HRV,2022/10/23,6,5356347,5356347
Croatia,10/24/22,1244692,17085,,,50,,30319.38475149491,,,,,191,HRV,2022/10/24,9,0,
Croatia,10/24/22,1244692,17085,,,50,,30319.38475149491,,,,,191,HRV,2022/10/24,9,5356347,5356347
Croatia,10/25/22,1244975,17096,,,283,,30326.278333107606,,,,,191,HRV,2022/10/25,11,0,
Croatia,10/25/22,1244975,17096,,,283,,30326.278333107606,,,,,191,HRV,2022/10/25,11,5356347,5356347
Croatia,10/26/22,1245552,17109,,,577,,30340.33344473491,,,,,191,HRV,2022/10/26,13,0,
Croatia,10/26/22,1245552,17109,,,577,,30340.33344473491,,,,,191,HRV,2022/10/26,13,5356347,5356347
Croatia,10/27/22,1246045,17117,,,493,,30352.34240492947,,,,,191,HRV,2022/10/27,8,0,
Croatia,10/27/22,1246045,17117,,,493,,30352.34240492947,,,,,191,HRV,2022/10/27,8,5356347,5356347
Croatia,10/28/22,1246375,17121,,,330,,30360.38085698668,,,,,191,HRV,2022/10/28,4,0,
Croatia,10/28/22,1246375,17121,,,330,,30360.38085698668,,,,,191,HRV,2022/10/28,4,5356347,5356347
Croatia,10/29/22,1246731,17128,,,356,,30369.052641630216,,,,,191,HRV,2022/10/29,7,0,
Croatia,10/29/22,1246731,17128,,,356,,30369.052641630216,,,,,191,HRV,2022/10/29,7,5356347,5356347
Croatia,10/30/22,1246920,17136,,,189,,30373.656482353894,,,,,191,HRV,2022/10/30,8,0,
Croatia,10/30/22,1246920,17136,,,189,,30373.656482353894,,,,,191,HRV,2022/10/30,8,5356347,5356347
Croatia,10/31/22,1246947,17142,,,27,,30374.314173885847,,,,,191,HRV,2022/10/31,6,0,
Croatia,10/31/22,1246947,17142,,,27,,30374.314173885847,,,,,191,HRV,2022/10/31,6,5356347,5356347
Croatia,11/1/22,1247199,17147,,,252,,30380.45262818408,,,,,191,HRV,2022/11/01,5,0,
Croatia,11/1/22,1247199,17147,,,252,,30380.45262818408,,,,,191,HRV,2022/11/01,5,5356347,5356347
Croatia,11/2/22,1247242,17156,,,43,,30381.50006284608,,,,,191,HRV,2022/11/02,9,0,
Croatia,11/2/22,1247242,17156,,,43,,30381.50006284608,,,,,191,HRV,2022/11/02,9,5356347,5356347
Croatia,11/3/22,1247678,17165,,,436,,30392.120563139848,,,,,191,HRV,2022/11/03,9,0,
Croatia,11/3/22,1247678,17165,,,436,,30392.120563139848,,,,,191,HRV,2022/11/03,9,5356347,5356347
Croatia,11/4/22,1248133,17176,,,455,,30403.203883400547,,,,,191,HRV,2022/11/04,11,0,
Croatia,11/4/22,1248133,17176,,,455,,30403.203883400547,,,,,191,HRV,2022/11/04,11,5356347,5356347
Croatia,11/5/22,1248450,17185,,,317,,30410.925669164597,,,,,191,HRV,2022/11/05,9,0,
Croatia,11/5/22,1248450,17185,,,317,,30410.925669164597,,,,,191,HRV,2022/11/05,9,5356347,5356347
Croatia,11/6/22,1248609,17191,,,159,,30414.798741519433,,,,,191,HRV,2022/11/06,6,0,
Croatia,11/6/22,1248609,17191,,,159,,30414.798741519433,,,,,191,HRV,2022/11/06,6,5356347,5356347
Croatia,11/7/22,1248635,17194,,,26,,30415.43207410576,,,,,191,HRV,2022/11/07,3,0,
Croatia,11/7/22,1248635,17194,,,26,,30415.43207410576,,,,,191,HRV,2022/11/07,3,5356347,5356347
Croatia,11/8/22,1248864,17200,,,229,,30421.010272654552,,,,,191,HRV,2022/11/08,6,0,
Croatia,11/8/22,1248864,17200,,,229,,30421.010272654552,,,,,191,HRV,2022/11/08,6,5356347,5356347
Croatia,11/9/22,1249239,17205,,,375,,30430.14487726502,,,,,191,HRV,2022/11/09,5,0,
Croatia,11/9/22,1249239,17205,,,375,,30430.14487726502,,,,,191,HRV,2022/11/09,5,5356347,5356347
Croatia,11/10/22,1249502,17212,,,263,,30436.55127996516,,,,,191,HRV,2022/11/10,7,,
Croatia,11/11/22,1249699,17215,,,197,,30441.349992253854,,,,,191,HRV,2022/11/11,3,,
Croatia,11/12/22,1249943,17218,,,244,,30447.293574987067,,,,,191,HRV,2022/11/12,3,,
Croatia,11/13/22,1250099,17223,,,156,,30451.093570505018,,,,,191,HRV,2022/11/13,5,,
Croatia,11/14/22,1250131,17233,,,32,,30451.87305676511,,,,,191,HRV,2022/11/14,10,,
Cuba,10/18/22,1111260,8530,,,0,,9811.050361378897,,,,,192,CUB,2022/10/18,0,0,
Cuba,10/18/22,1111260,8530,,,0,,9811.050361378897,,,,,192,CUB,2022/10/18,0,42212832,42212832
Cuba,10/19/22,1111263,8530,,,3,,9811.07684766571,,,,,192,CUB,2022/10/19,0,0,
Cuba,10/19/22,1111263,8530,,,3,,9811.07684766571,,,,,192,CUB,2022/10/19,0,42221794,42221794
Cuba,10/20/22,1111265,8530,,,2,,9811.094505190253,,,,,192,CUB,2022/10/20,0,0,
Cuba,10/20/22,1111265,8530,,,2,,9811.094505190253,,,,,192,CUB,2022/10/20,0,42232674,42232674
Cuba,10/21/22,1111266,8530,,,1,,9811.103333952524,,,,,192,CUB,2022/10/21,0,0,
Cuba,10/21/22,1111266,8530,,,1,,9811.103333952524,,,,,192,CUB,2022/10/21,0,42246483,42246483
Cuba,10/22/22,1111267,8530,,,1,,9811.112162714795,,,,,192,CUB,2022/10/22,0,0,
Cuba,10/22/22,1111267,8530,,,1,,9811.112162714795,,,,,192,CUB,2022/10/22,0,42269794,42269794
Cuba,10/24/22,1111273,8530,,,6,,9811.165135288422,,,,,192,CUB,2022/10/24,0,0,
Cuba,10/24/22,1111273,8530,,,6,,9811.165135288422,,,,,192,CUB,2022/10/24,0,42274548,42274548
Cuba,10/25/22,1111274,8530,,,1,,9811.173964050693,,,,,192,CUB,2022/10/25,0,0,
Cuba,10/25/22,1111274,8530,,,1,,9811.173964050693,,,,,192,CUB,2022/10/25,0,42276214,42276214
Cuba,10/26/22,1111277,8530,,,3,,9811.200450337506,,,,,192,CUB,2022/10/26,0,0,
Cuba,10/26/22,1111277,8530,,,3,,9811.200450337506,,,,,192,CUB,2022/10/26,0,42284136,42284136
Cuba,10/27/22,1111278,8530,,,1,,9811.209279099778,,,,,192,CUB,2022/10/27,0,0,
Cuba,10/27/22,1111278,8530,,,1,,9811.209279099778,,,,,192,CUB,2022/10/27,0,42292797,42292797
Cuba,10/28/22,1111279,8530,,,1,,9811.218107862049,,,,,192,CUB,2022/10/28,0,0,
Cuba,10/28/22,1111279,8530,,,1,,9811.218107862049,,,,,192,CUB,2022/10/28,0,42319785,42319785
Cuba,10/29/22,1111281,8530,,,2,,9811.235765386591,,,,,192,CUB,2022/10/29,0,0,
Cuba,10/29/22,1111281,8530,,,2,,9811.235765386591,,,,,192,CUB,2022/10/29,0,42319785,42319785
Cuba,10/30/22,1111284,8530,,,3,,9811.262251673403,,,,,192,CUB,2022/10/30,0,0,
Cuba,10/30/22,1111284,8530,,,3,,9811.262251673403,,,,,192,CUB,2022/10/30,0,42319785,42319785
Cuba,10/31/22,1111285,8530,,,1,,9811.271080435674,,,,,192,CUB,2022/10/31,0,0,
Cuba,10/31/22,1111285,8530,,,1,,9811.271080435674,,,,,192,CUB,2022/10/31,0,42349342,42349342
Cuba,11/1/22,1111286,8530,,,1,,9811.279909197945,,,,,192,CUB,2022/11/01,0,0,
Cuba,11/1/22,1111286,8530,,,1,,9811.279909197945,,,,,192,CUB,2022/11/01,0,42351544,42351544
Cuba,11/2/22,1111287,8530,,,1,,9811.288737960216,,,,,192,CUB,2022/11/02,0,0,
Cuba,11/2/22,1111287,8530,,,1,,9811.288737960216,,,,,192,CUB,2022/11/02,0,42362502,42362502
Cuba,11/3/22,1111290,8530,,,3,,9811.31522424703,,,,,192,CUB,2022/11/03,0,0,
Cuba,11/3/22,1111290,8530,,,3,,9811.31522424703,,,,,192,CUB,2022/11/03,0,42372894,42372894
Cuba,11/4/22,1111291,8530,,,1,,9811.3240530093,,,,,192,CUB,2022/11/04,0,0,
Cuba,11/4/22,1111291,8530,,,1,,9811.3240530093,,,,,192,CUB,2022/11/04,0,42396652,42396652
Cuba,11/5/22,1111292,8530,,,1,,9811.332881771572,,,,,192,CUB,2022/11/05,0,0,
Cuba,11/5/22,1111292,8530,,,1,,9811.332881771572,,,,,192,CUB,2022/11/05,0,42396652,42396652
Cuba,11/6/22,1111296,8530,,,4,,9811.368196820657,,,,,192,CUB,2022/11/06,0,0,
Cuba,11/6/22,1111296,8530,,,4,,9811.368196820657,,,,,192,CUB,2022/11/06,0,42405222,42405222
Cuba,11/7/22,1111298,8530,,,2,,9811.385854345199,,,,,192,CUB,2022/11/07,0,0,
Cuba,11/7/22,1111298,8530,,,2,,9811.385854345199,,,,,192,CUB,2022/11/07,0,42410035,42410035
Cuba,11/8/22,1111300,8530,,,2,,9811.403511869741,,,,,192,CUB,2022/11/08,0,0,
Cuba,11/8/22,1111300,8530,,,2,,9811.403511869741,,,,,192,CUB,2022/11/08,0,42410778,42410778
Cuba,11/9/22,1111303,8530,,,3,,9811.429998156555,,,,,192,CUB,2022/11/09,0,0,
Cuba,11/9/22,1111303,8530,,,3,,9811.429998156555,,,,,192,CUB,2022/11/09,0,42418410,42418410
Cuba,11/10/22,1111311,8530,,,8,,9811.500628254724,,,,,192,CUB,2022/11/10,0,,
Cuba,11/12/22,1111317,8530,,,6,,9811.55360082835,,,,,192,CUB,2022/11/12,0,,
Cuba,11/13/22,1111321,8530,,,4,,9811.588915877433,,,,,192,CUB,2022/11/13,0,,
Cuba,11/14/22,1111328,8530,,,7,,9811.650717213332,,,,,192,CUB,2022/11/14,0,,
Cyprus,10/18/22,593542,1189,,,0,,49160.2760069275,,,,,196,CYP,2022/10/18,0,0,
